text,intent
"okay, where did I leave my backpack?",memory_retrieval
I need to save my project before it crashes.,chat
"For future chats, use less jargon.",memory_update
You should know that I prefer step-by-step explanations.,memory_update
Face the desk.,movement
"hey, where did I leave my soccer ball?",memory_retrieval
Remember my nickname is Blue.,memory_update
Back up gently.,movement
Walk away from me.,movement
Please remember that the sketchbook is in the previous room.,memory_update
"hey, do you remember my favorite game?",memory_retrieval
Please go to the charging station for a few seconds.,movement
Walk with me to the library.,movement
"Which is cooler, Pinterest or Duolingo?",chat
"okay, what was the thing I asked you not to forget?",memory_retrieval
Can you help me brainstorm a project about AI safety?,chat
"yo, do you remember my favorite game?",memory_retrieval
"for a second, face clockwise .",movement
"actually, turn around carefully.",movement
"okay, where did I leave my ID card?",memory_retrieval
Can you help me write a sentence about creative writing?,chat
quick question: do you know whether I like examples?,memory_retrieval
What is stored in my profile?,memory_retrieval
Do you like Snapchat or Canva better?,chat
Save this detail: I like linear algebra.,memory_update
quick question: what did you save about my charger?,memory_retrieval
Have you ever heard of Stardew Valley?,chat
Call me Sam from now on.,memory_update
do you like music,chat
"hey, okay, can you move to the charging station in a straight line?",movement
quick question: what's my favorite social platform?,memory_retrieval
Can you explain soccer like I am new to it?,chat
"For future chats, use concise bullet points.",memory_update
"yo, where did I leave my planner?",memory_retrieval
"yo, can you recall the note about the backpack?",memory_retrieval
"okay, change my preferred editor to IntelliJ.",memory_update
Please remember that the phone charger is next to the couch.,memory_update
I usually want answers about linear algebra to be short.,memory_update
"okay, what is the difference between a database and learning?",chat
Remember that my favorite club topic is Python.,memory_update
Note that my favorite app is TikTok.,memory_update
"Which is cooler, YouTube or GitHub?",chat
quick question: what did I tell you about my laptop?,memory_retrieval
"When you finish moving, return to the library.",memory_update
What note did I leave about coming back?,memory_retrieval
Update my favorite social platform to Reddit.,memory_update
"yo, do you know my nickname?",memory_retrieval
I usually want answers about USACO to be visual.,memory_update
have you ever heard of Pokemon?,chat
"Come closer, but do it carefully.",movement
Can you compare Geometry Dash and Valorant?,chat
"okay, store this preference: I like concise bullet points.",memory_update
"yo, can you recall the note about the camera?",memory_retrieval
Can you move backward in a straight line?,movement
"okay, i moved my chair earlier and now I cannot find it.",chat
I usually want answers about data science to be intuitive.,memory_update
"Which is cooler, TikTok or Notion?",chat
"hey, can you recall the note about the ID card?",memory_retrieval
"Which is cooler, Spotify or Reddit?",chat
Do you know whether I like examples?,memory_retrieval
"okay, where is the sketchbook?",memory_retrieval
Can you help me write a sentence about robotics?,chat
Turn so your front is facing the whiteboard.,movement
Can you compare Chess and Tetris?,chat
I usually want answers about robotics to be short.,memory_update
"yo, what did I tell you about the hallway?",memory_retrieval
"okay, where is the jacket?",memory_retrieval
Call me Kai from now on.,memory_update
hello bestie,chat
"yo, do you know whether I like simple explanations?",memory_retrieval
"yo, can you recall the note about the soccer ball?",memory_retrieval
"yo, can you recall the note about the laptop?",memory_retrieval
Store this preference: I like concise bullet points.,memory_update
Go toward me.,movement
do you know any fun facts,chat
Walk into the hallway.,movement
"yo, what did I say my current project was?",memory_retrieval
Scoot back at normal speed.,movement
Store this preference: I like beginner-friendly explanations.,memory_update
Please go farther carefully.,movement
quick question: did I tell you my favorite game?,memory_retrieval
Do you like Notion or Notion better?,chat
Remember this room is the hallway.,memory_update
"hey, add to my notes that I play Brawl Stars.",memory_update
"Which is cooler, TikTok or Discord?",chat
good morning!!,chat
Put in memory that I prefer Python for projects.,memory_update
I need to save my code before it crashes.,chat
I need to save this Python model later.,chat
hi BELT,chat
I usually want answers about linear algebra to be step-by-step.,memory_update
"okay, what did I tell you about the hallway?",memory_retrieval
"hey, can you check out the charging area and come back?",movement
"for a second, can you move backward carefully?",movement
How would you describe yourself as a campus robot?,chat
Stop moving for a second.,movement
Walk to the previous room.,movement
"okay, can you move around in a straight line?",movement
"Which is cooler, Discord or Google Docs?",chat
Where did I leave my ID card?,memory_retrieval
What is the difference between storage and a list?,chat
I need to save my file before it crashes.,chat
Where is the planner?,memory_retrieval
What is the difference between RAM and a list?,chat
"uh, can you move to the previous room three small steps?",movement
Remember this room is the maker space.,memory_update
Log this: my current project is about intent classification.,memory_update
Save that I left the robot manual in the previous room.,memory_update
Save this detail: I like USACO.,memory_update
"hey, do you know whether I like short answers?",memory_retrieval
Keep in mind that I am learning USACO.,memory_update
Face the exit.,movement
"yo, do you know whether I like debugging hints?",memory_retrieval
"yo, what topic am I learning right now?",memory_retrieval
Log this: my current project is about RAG.,memory_update
"like, turn around real quick.",movement
I need you to reposition near the wall.,movement
"hey, what is stored in my profile?",memory_retrieval
Rotate toward the hallway carefully.,movement
Scoot forward in a straight line.,movement
I usually want answers about USACO to be beginner friendly.,memory_update
Keep in mind that I am learning Python.,memory_update
"for a second, rotate toward the whiteboard .",movement
"hey, what did I tell you about VSCode?",memory_retrieval
Park next to the wall.,movement
"hey, what do you remember about me?",memory_retrieval
Change my preferred editor to VSCode.,memory_update
I usually want answers about creative writing to be intuitive.,memory_update
Can you help me brainstorm a project about machine learning?,chat
Advance in a straight line.,movement
Remember that my favorite club topic is linear algebra.,memory_update
Can you compare Roblox and Stardew Valley?,chat
"okay, can you pull up my memory?",memory_retrieval
What is the difference between storage and a model?,chat
Save that I left the calculator next to the couch.,memory_update
Can you move like two steps left?,movement
How does a robot know where it is?,chat
Note that my favorite app is Instagram.,memory_update
Roll into the hallway.,movement
What does the word pipeline mean?,chat
Can you move right two steps?,movement
"Which is cooler, Notion or Snapchat?",chat
"okay, do you know whether I like simple explanations?",memory_retrieval
quick question: can you recall the note about the jacket?,memory_retrieval
Shift backward one step.,movement
"bro, face toward the hallway real quick.",movement
I usually want answers about machine learning to be beginner friendly.,memory_update
You should know that I prefer friendly tone.,memory_update
Tell me a tiny fun fact about cats.,chat
Remember when we talked about homework? That was funny.,chat
Move away from me in a straight line.,movement
quick question: who made you?,memory_retrieval
What is the difference between memory and learning?,chat
"okay, did I tell you my favorite game?",memory_retrieval
"okay, what is stored in my profile?",memory_retrieval
What is the difference between memory and a list?,chat
Can you move beside the desk for a few seconds?,movement
Walk to the door.,movement
Save that I left the phone charger at the front desk.,memory_update
Remember this room is the stairwell.,memory_update
"robot buddy, can you roll forward a couple steps?",movement
"hey, what did you save about my charger?",memory_retrieval
Shift forward two steps.,movement
Scoot right one step.,movement
Drive to the previous room.,movement
"For future chats, use step-by-step explanations.",memory_update
Remember when we talked about YouTube? That was funny.,chat
quick question: did I tell you my favorite color?,memory_retrieval
"hey, what saved details do you have for me?",memory_retrieval
"yo, did I tell you my favorite animal?",memory_retrieval
Can you explain why TF-IDF works?,chat
"hey, walk with me to the maker space.",movement
"The water bottle is in the lab, keep that in memory.",memory_update
Tell me a tiny fun fact about Minecraft.,chat
"hey, who made you?",memory_retrieval
I usually want answers about machine learning to be step-by-step.,memory_update
Please go farther one step.,movement
Remember that my favorite animal is a penguin.,memory_update
"Which is cooler, Reddit or Instagram?",chat
Do you like Google Docs or VSCode better?,chat
"yo, take a small step toward the hallway.",movement
good afternoon!!,chat
quick question: note that my favorite app is YouTube.,memory_update
Remember when we talked about space? That was funny.,chat
Drive away from me.,movement
Scoot back one step.,movement
quick question: advance without rushing.,movement
Reverse just a bit.,movement
quick question: where is the backpack?,memory_retrieval
quick question: can you check out the charging area and come back?,movement
do you like YouTube or TikTok better please?,chat
"okay, what did you save about my backpack?",memory_retrieval
Please go right a little bit.,movement
Add to my notes that I play Tetris.,memory_update
What saved details do you have for me?,memory_retrieval
Where is the headphones?,memory_retrieval
"okay, do you know whether I like math details?",memory_retrieval
Remember that my favorite animal is a fox.,memory_update
Tell me a tiny fun fact about space.,chat
Go forward.,movement
What is the difference between a database and thinking?,chat
Add to my notes that I play Stardew Valley.,memory_update
"hey, can you recall the note about the headphones?",memory_retrieval
quick question: where is the USB drive?,memory_retrieval
Can you move like one tile forward?,movement
good morning belt,chat
Come closer just a bit.,movement
What does the word embedding mean?,chat
Do you like Google Docs or YouTube better?,chat
Take a small step toward the whiteboard.,movement
Do not forget that I like ice cream after coding sessions.,memory_update
Can you compare Among Us and Minecraft?,chat
What did you save about my project?,memory_retrieval
Roll farther.,movement
"From now on, if I ask about math, give me more intuition.",memory_update
Make a note that I use Neovim for coding.,memory_update
Shift forward a couple steps.,movement
Walk with me to the maker space.,movement
quick question: can you recall the note about the backpack?,memory_retrieval
Remember when we talked about movies? That was funny.,chat
Do you like Spotify or Pinterest better?,chat
Save that I left the jacket by the door.,memory_update
Add to my notes that I play Terraria.,memory_update
"okay, where did I leave my phone charger?",memory_retrieval
"hey, i moved my dataset earlier and now I cannot find it.",chat
"okay, where is the USB drive?",memory_retrieval
can you tell a joke please?,chat
"Go check the exit area, then return here.",movement
"okay, what is my favorite animal?",memory_retrieval
Take a small step toward the door.,movement
Can you move away from me one step?,movement
Save that the emergency exit is to the left.,memory_update
Face the window.,movement
Go around the cone.,movement
Rotate right like two feet.,movement
Back up without rushing.,movement
Can you move like a tiny bit left?,movement
Can you move beside the desk without rushing?,movement
Can you compare Terraria and Geometry Dash?,chat
Remember that my favorite club topic is computer vision.,memory_update
Do you like Duolingo or Pinterest better?,chat
"okay, what did I tell you about Brawl Stars?",memory_retrieval
Add to my notes that I play Celeste.,memory_update
Do you like TikTok or Spotify better?,chat
My favorite color is red.,memory_update
Do you like Twitch or Twitch better?,chat
"Can you roast my code gently, not brutally?",chat
can you talk real quick?,chat
Please remember that the sketchbook is next to the printer.,memory_update
Navigate toward the door.,movement
Back up carefully.,movement
"Which is cooler, Pinterest or YouTube?",chat
quick question: what is stored in my profile?,memory_retrieval
Make a note that I use Vim for coding.,memory_update
"hey, what location did I tell you to remember?",memory_retrieval
Remember this room is the science wing.,memory_update
quick question: where did I leave my headphones?,memory_retrieval
What should I name my robot assistant?,chat
What location did I tell you to remember?,memory_retrieval
Go to the whiteboard.,movement
"okay, what is my favorite color?",memory_retrieval
"Which is cooler, Duolingo or Notion?",chat
"yo, add to my notes that I play Honkai Star Rail.",memory_update
Go to the nearest exit.,movement
Please go to the door for a few seconds.,movement
Remember that my favorite animal is a dog.,memory_update
"when you finish moving, return to the science wing.",memory_update
Where did I put my laptop?,memory_retrieval
Rotate toward the whiteboard for a few seconds.,movement
"hey, can you recall the note about the soccer ball?",memory_retrieval
Save that the emergency exit is down the hallway.,memory_update
"okay, rotate around please.",movement
"I prefer being called Maya, please remember.",memory_update
Do you like YouTube or Discord better?,chat
What object did I say was on the desk?,memory_retrieval
quick question: do you remember my favorite game?,memory_retrieval
"Hey, turn toward the hallway.",movement
Can you make a silly sentence about a fox?,chat
Note that my favorite app is VSCode.,memory_update
Save that I left the ID card in the lab.,memory_update
Store this preference: I like step-by-step explanations.,memory_update
Go around the box.,movement
Save that I left the soccer ball near the hallway.,memory_update
BELT should remember that Riley likes Fortnite.,memory_update
"okay, what did you save about my explanation style?",memory_retrieval
Can you help me write a sentence about Python?,chat
My favorite IDE is Visual Studio.,memory_update
Can you compare Honkai Star Rail and Pokemon?,chat
"Which is cooler, TikTok or Spotify?",chat
"yo, does BELT have a favorite ice cream flavor?",chat
Come closer slowly.,movement
"hey, do you know whether I like math details?",memory_retrieval
Remember that my favorite club topic is USACO.,memory_update
Update my favorite social platform to Spotify.,memory_update
good morning robot,chat
quick question: let's move on to debugging.,chat
Can you explain machine learning like I am new to it?,chat
Do you know where the nearest exit is?,memory_retrieval
Park next to the whiteboard.,movement
Where is the notebook?,memory_retrieval
"hey BELT, rotate left .",movement
Save that my favorite game is Stardew Valley.,memory_update
how do I start learning Python,chat
Note for later: I want BELT to be calm.,memory_update
You should know that I prefer plain English.,memory_update
"yo, show my saved memory.",memory_retrieval
"yo, where is the jacket?",memory_retrieval
Can you compare Pokemon and Geometry Dash?,chat
Save that I left the sketchbook on the left shelf.,memory_update
can you help me debug code?,chat
Park next to the charging station.,movement
quick question: what programming language did I say I prefer?,memory_retrieval
Do you like Canva or Twitch better?,chat
Store this preference: I like examples first.,memory_update
"If a owl learned Python, what would it build?",chat
Save this detail: I like PCA.,memory_update
"Hey, turn ninety degrees left.",movement
"yo, where did I leave my headphones?",memory_retrieval
"okay, bELT should remember that Chris likes Terraria.",memory_update
"hey, from now on, if I ask about math, give me concise bullet points.",memory_update
You should know that I prefer math after intuition.,memory_update
Face the hallway.,movement
Save that my favorite game is Chess.,memory_update
What do you think about memes?,chat
Remember my nickname is Skye.,memory_update
Have you ever heard of Roblox?,chat
Come closer without rushing.,movement
Can you compare Mario Kart and Celeste?,chat
Move away from me smoothly.,movement
Remember that my favorite animal is a dragonfly.,memory_update
Can you list my saved notes?,memory_retrieval
My favorite color is mint.,memory_update
I need to save my model before it crashes.,chat
Roll forward.,movement
"Which is cooler, Twitch or Spotify?",chat
Put in memory that I prefer Scratch for projects.,memory_update
Walk beside the desk.,movement
quick question: what do you remember about me?,memory_retrieval
Store this preference: I like short answers.,memory_update
Back up smoothly.,movement
Where did I leave my laptop?,memory_retrieval
BELT should remember that Kai likes Minecraft.,memory_update
Reverse two steps.,movement
"yo, come closer at normal speed.",movement
"actually, turn toward me carefully.",movement
"Yo, turn a little right.",movement
Return to the hallway entrance.,movement
"From now on, if I ask about math, give me friendly tone.",memory_update
Please go toward the exit smoothly.,movement
Face the door.,movement
Do you like Instagram or Duolingo better?,chat
"If a otter learned Python, what would it build?",chat
"Hey, turn around.",movement
My favorite IDE is Eclipse.,memory_update
quick question: can you recall the note about the USB drive?,memory_retrieval
"hey, go check the exit area, then return here.",movement
What did I tell you about my laptop?,memory_retrieval
"yo, what object was I talking about earlier?",memory_retrieval
Have you ever heard of Terraria?,chat
"hey, what did I tell you about Brawl Stars?",memory_retrieval
Can you move to the charging station gently?,movement
"I am bored, talk to me about food.",chat
quick question: where did I leave my water bottle?,memory_retrieval
Make a note that I use PyCharm for coding.,memory_update
"Which is cooler, Pinterest or Spotify?",chat
Shift backward in a straight line.,movement
Keep in mind that I am learning game design.,memory_update
Can you help me brainstorm a project about computer vision?,chat
Do you like YouTube or Reddit better?,chat
Can you explain data science like I am new to it?,chat
quick question: what is my favorite color?,memory_retrieval
"hey, where did I leave my jacket?",memory_retrieval
Note that my favorite app is Google Docs.,memory_update
"please, can you roll right for a few seconds?",movement
"hey, which direction did I say the exit was?",memory_retrieval
quick question: note that my favorite app is Notion.,memory_update
What is your favorite coding language?,chat
Do you like Spotify or TikTok better?,chat
Can you compare Tetris and Tetris?,chat
"hey, where did I leave my USB drive?",memory_retrieval
What do you think about YouTube?,chat
"please, face a little right real quick.",movement
What does the word solver mean?,chat
Can you make a silly sentence about a axolotl?,chat
quick question: what should you call me?,memory_retrieval
quick question: put in memory that I prefer C++ for projects.,memory_update
"For future chats, use friendly tone.",memory_update
"Which is cooler, Discord or Twitch?",chat
BELT should remember that Riley likes Tetris.,memory_update
"hey, did I tell you my favorite platform?",memory_retrieval
Rotate ninety degrees right a couple steps.,movement
Do you like Canva or Canva better?,chat
Can you make a silly sentence about a turtle?,chat
Can you compare Celeste and Terraria?,chat
quick question: note for later: I want BELT to be slightly witty.,memory_update
"okay, please remember that the backpack is on the table.",memory_update
BELT should remember that Riley likes Terraria.,memory_update
Remember to come back to the computer lab.,memory_update
"okay, what did I say my current project was?",memory_retrieval
"I am bored, talk to me about movies.",chat
can you help me debug code!,chat
Go beside the desk.,movement
"Yo, turn toward me.",movement
quick question: did I tell you my favorite IDE?,memory_retrieval
Remember when we talked about Brawl Stars? That was funny.,chat
Rotate a little right carefully.,movement
Shift left just a bit.,movement
Add to my notes that I play Minecraft.,memory_update
quick question: can you recall the note about the camera?,memory_retrieval
"hey, what did you save about my explanation style?",memory_retrieval
Rotate toward the whiteboard slowly.,movement
Can you move like a tiny bit forward?,movement
"Which is cooler, VSCode or Snapchat?",chat
Add to my notes that I play Fortnite.,memory_update
"okay, where is the backpack?",memory_retrieval
Please remember that the planner is beside the whiteboard.,memory_update
Note that my favorite app is Spotify.,memory_update
"Yoo, what are you up to today?",chat
Drive farther.,movement
good evening bestie,chat
Can you move like half a meter back?,movement
Save that I left the calculator on the desk.,memory_update
"I am bored, talk to me about books.",chat
"yo, have you ever heard of Tetris?",chat
what is your favorite color?,chat
"hey, can you recall the note about the jacket?",memory_retrieval
Remember when we talked about cats? That was funny.,chat
quick question: which direction did I say the exit was?,memory_retrieval
"yo, what did I tell you about my laptop?",memory_retrieval
Where is the camera?,memory_retrieval
Move away from me a couple steps.,movement
"okay, what does the word classifier mean?",chat
Reverse gently.,movement
Tell me a tiny fun fact about soccer.,chat
You should know that I prefer examples first.,memory_update
"okay, do you know whether I like debugging hints?",memory_retrieval
"uh, turn clockwise please.",movement
how do I start learning Python please?,chat
Call me Maya from now on.,memory_update
"okay, where is the robot manual?",memory_retrieval
Tell me a tiny fun fact about school.,chat
What do you think about movies?,chat
"yo, which room did I say this was?",memory_retrieval
Back up at normal speed.,movement
What is the difference between a database and a hard drive?,chat
"yo, remember to come back to the charging area.",memory_update
Do not forget that I like dumplings after coding sessions.,memory_update
what's up!!,chat
"I am bored, talk to me about homework.",chat
Remember that my favorite animal is a hamster.,memory_update
BELT should remember that Jordan likes Brawl Stars.,memory_update
Go closer.,movement
"yo, where is the notebook?",memory_retrieval
"okay, i prefer being called Casey, please remember.",memory_update
"hey, what was the thing I asked you not to forget?",memory_retrieval
"okay, where did I leave my camera?",memory_retrieval
"yo, note for later: I want BELT to be curious.",memory_update
"yo, what did I tell you about Brawl Stars?",memory_retrieval
Walk down the hallway with me.,movement
Rotate toward the whiteboard gently.,movement
Do you like Duolingo or Reddit better?,chat
"hey, for future chats, use direct feedback.",memory_update
Have you ever heard of Minecraft?,chat
Note that my favorite app is Discord.,memory_update
"Which is cooler, Duolingo or Canva?",chat
Remember to come back to the maker space.,memory_update
Rotate left one step.,movement
"The calculator is near the charging station, keep that in memory.",memory_update
"yo, did I tell you my favorite game?",memory_retrieval
Navigate toward the robotics lab.,movement
You should know that I prefer beginner-friendly explanations.,memory_update
Remember my nickname is Rin.,memory_update
Can you compare Brawl Stars and Brawl Stars?,chat
Roll toward the exit.,movement
Put in memory that I prefer TypeScript for projects.,memory_update
quick question: what did I say my current project was?,memory_retrieval
Can you check out the charging area and come back?,movement
Navigate toward the front desk.,movement
"The phone charger is on the left shelf, keep that in memory.",memory_update
quick question: where is the headphones?,memory_retrieval
"If a turtle learned Python, what would it build?",chat
I usually want answers about soccer to be visual.,memory_update
