text,intent
Please go around gently.,movement
What is a good beginner project with NLP?,chat
Shift right slowly.,movement
"yo, note for later: I want BELT to be calm.",memory_update
You should know that I prefer direct feedback.,memory_update
What room are we supposed to return to?,memory_retrieval
Please remember that the robot manual is on the table.,memory_update
Can you move around like two feet?,movement
How's your robot day going?,chat
quick question: what saved details do you have for me?,memory_retrieval
Please remember that the planner is in the previous room.,memory_update
quick question: what did I tell you about VSCode?,memory_retrieval
Remember I am working on BELT.,memory_update
quick question: can you recall the note about the headphones?,memory_retrieval
Did I tell you my favorite food?,memory_retrieval
"For future chats, use beginner-friendly explanations.",memory_update
"okay, what IDE do I use?",memory_retrieval
"The USB drive is by the window, keep that in memory.",memory_update
What do you think about music?,chat
Call me Morgan from now on.,memory_update
Come closer carefully.,movement
quick question: i moved my code earlier and now I cannot find it.,chat
can you talk,chat
"If a capybara learned Python, what would it build?",chat
"quick question: actually, face counterclockwise please.",movement
What do you think about dogs?,chat
"okay, can you recall the note about the planner?",memory_retrieval
"hey, what did I tell you about my laptop?",memory_retrieval
Remember to come back to the front office.,memory_update
"yo, can you recall the note about the notebook?",memory_retrieval
Can you help me write a sentence about calculus?,chat
good morning bestie,chat
Advance two steps.,movement
can you recall the note about the phone charger?,memory_retrieval
Can you move like a couple feet back?,movement
"okay, can you recall the note about the headphones?",memory_retrieval
Come closer gently.,movement
What is the difference between RAM and a hard drive?,chat
Can you compare Stardew Valley and Terraria?,chat
What do you think about games?,chat
What did I tell you about Instagram?,memory_retrieval
"yo, can you pull up my memory?",memory_retrieval
Save that I left the water bottle on the left shelf.,memory_update
"hey, i prefer being called Alex, please remember.",memory_update
Where did I leave my calculator?,memory_retrieval
"when you can, rotate left carefully.",movement
Do you like Twitch or Discord better?,chat
Advance for a few seconds.,movement
are you awake?,chat
quick question: did I tell you my favorite food?,memory_retrieval
Move to the charging station.,movement
"yo, what is stored in my profile?",memory_retrieval
Did I tell you my favorite game?,memory_retrieval
"hey, can you recall the note about the calculator?",memory_retrieval
"hey, can you help me brainstorm a project about Python?",chat
Can you help me write a sentence about game design?,chat
quick question: where did I leave my camera?,memory_retrieval
Go to the charging station.,movement
"hey, save that the emergency exit is behind us.",memory_update
Rotate right three small steps.,movement
what is the difference between AI and ML?,chat
Can you help me brainstorm a project about linear algebra?,chat
"From now on, if I ask about math, give me plain English.",memory_update
Keep in mind that I am learning algorithms.,memory_update
"okay, note that my favorite app is Notion.",memory_update
"hey, how would you describe yourself as a campus robot?",chat
quick question: what did I tell you about the previous room?,memory_retrieval
Shift forward for a few seconds.,movement
"yo, where is the backpack?",memory_retrieval
I usually want answers about USACO to be example-driven.,memory_update
"yo, what was the thing I asked you not to forget?",memory_retrieval
quick question: which app did I say I liked most?,memory_retrieval
What did you save about my laptop?,memory_retrieval
"hey, what should you call me?",memory_retrieval
I need you to reposition near the door.,movement
Make a note that I use Visual Studio for coding.,memory_update
"The headphones is next to the couch, keep that in memory.",memory_update
Do you like Discord or Google Docs better?,chat
quick question: can you compare Honkai Star Rail and Stardew Valley?,chat
Can you make a silly sentence about a cat?,chat
"yo, did I tell you my favorite platform?",memory_retrieval
"Buddy, turn toward the hallway.",movement
quick question: where did I leave my sketchbook?,memory_retrieval
"bro, rotate toward me real quick.",movement
Can you help me brainstorm a project about USACO?,chat
"okay, i usually want answers about AI safety to be step-by-step.",memory_update
Have you ever heard of Honkai Star Rail?,chat
"okay, where is the calculator?",memory_retrieval
Can you make room and move to the side?,movement
What did I tell you about the previous room?,memory_retrieval
I am your tester.,memory_update
can you help me debug code real quick?,chat
good afternoon BELT,chat
Can you explain AI safety like I am new to it?,chat
can you tell a joke real quick?,chat
Save this detail: I like soccer.,memory_update
Can you explain Minecraft lore like I am new to it?,chat
"yo, what did I tell you about VSCode?",memory_retrieval
Change my preferred editor to Sublime Text.,memory_update
Save that the emergency exit is to the right.,memory_update
can you tell a joke,chat
"if it is safe, can you walk backward a little bit?",movement
Call me Bella from now on.,memory_update
What is the difference between a database and learning?,chat
"okay, i usually want answers about creative writing to be step-by-step.",memory_update
"yo, where did I leave my soccer ball?",memory_retrieval
Tell me a tiny fun fact about YouTube.,chat
"Bro, move a couple steps back.",movement
"hey, note for later: I want BELT to be patient.",memory_update
Move away from me without rushing.,movement
"Which is cooler, Discord or Reddit?",chat
"I prefer being called Taylor, please remember.",memory_update
Move to the nearest emergency exit please.,movement
My favorite IDE is IntelliJ.,memory_update
Save that my favorite game is Among Us.,memory_update
Remember I am working on a robot assistant.,memory_update
Change my preferred editor to Eclipse.,memory_update
"hey, can you recall the note about the robot manual?",memory_retrieval
"okay, where did I leave my calculator?",memory_retrieval
Rotate toward the hallway a little bit.,movement
quick question: what did you save about my backpack?,memory_retrieval
quick question: can you recall the note about the laptop?,memory_retrieval
what's up robot,chat
Can you recall the note about the robot manual?,memory_retrieval
Tell me a tiny fun fact about homework.,chat
what can you do?,chat
"hey, where did I leave my robot manual?",memory_retrieval
hey robot,chat
Do not forget that I like bagels after coding sessions.,memory_update
Can you explain USACO like I am new to it?,chat
I moved my file earlier and now I cannot find it.,chat
Reverse in a straight line.,movement
"yo, face the desk.",movement
quick question: does BELT have a favorite ice cream flavor?,chat
"okay, what's my favorite social platform?",memory_retrieval
Face me.,movement
What topic am I learning right now?,memory_retrieval
"hey, do not forget that I like burritos after coding sessions.",memory_update
"Which is cooler, Canva or TikTok?",chat
Please go farther smoothly.,movement
"okay, where did I leave my jacket?",memory_retrieval
"okay, okay, turn clockwise real quick.",movement
"For future chats, use more intuition.",memory_update
quick question: walk into the hallway.,movement
"hey, what game did I say I play?",memory_retrieval
quick question: what is the difference between memory and a list?,chat
My favorite color is cyan.,memory_update
Advance one step.,movement
quick question: what was the thing I asked you not to forget?,memory_retrieval
Save that my favorite game is Pokemon.,memory_update
are you awake,chat
Can you move like a couple feet left?,movement
what is the difference between AI and ML real quick?,chat
"hey, where did I leave my planner?",memory_retrieval
My favorite color is yellow.,memory_update
"hey, can you recall the note about the phone charger?",memory_retrieval
What does the word intent mean?,chat
Call me Alex from now on.,memory_update
"okay, what room are we supposed to return to?",memory_retrieval
Tell me a tiny fun fact about robots.,chat
what is the difference between AI and ML,chat
Can you check out the corner and come back?,movement
do you like YouTube or TikTok better?,chat
"yo, can you recall the note about the calculator?",memory_retrieval
Please remember that the phone charger is at the front desk.,memory_update
"yo, where is the sketchbook?",memory_retrieval
quick question: what do you think about games?,chat
What food did I tell you I like?,memory_retrieval
Please remember that the sketchbook is near the hallway.,memory_update
BELT should remember that Sam likes Chess.,memory_update
"okay, move out of the walkway.",movement
"okay, turn left real quick.",movement
Can you recall the note about the headphones?,memory_retrieval
"The calculator is by the door, keep that in memory.",memory_update
quick question: where did I leave my robot manual?,memory_retrieval
Do you like VSCode or Pinterest better?,chat
"For future chats, use tiny summaries.",memory_update
Can you compare Among Us and Brawl Stars?,chat
Can you help me brainstorm a project about creative writing?,chat
"hey, where is the jacket?",memory_retrieval
"okay, what did you save about my laptop?",memory_retrieval
Walk to the charging station.,movement
"yo, go around the table.",movement
I usually want answers about AI safety to be intuitive.,memory_update
Walk around.,movement
What did I ask you to remember?,memory_retrieval
"okay, what is your favorite robot movie?",chat
Update my favorite social platform to Snapchat.,memory_update
"Which is cooler, YouTube or Google Docs?",chat
Where is the sketchbook?,memory_retrieval
Reverse a little bit.,movement
Can you move backward three small steps?,movement
Move away from me just a bit.,movement
Note for later: I want belt to be extra clear.,memory_update
Remember this room is the previous room.,memory_update
What is the difference between a database and a list?,chat
"yo, what did I tell you about the previous room?",memory_retrieval
Where did I leave my phone charger?,memory_retrieval
You should know that I prefer less jargon.,memory_update
"okay, do you remember my favorite game?",memory_retrieval
Save that I left the sketchbook in the lab.,memory_update
"hey, save that I left the camera inside my backpack.",memory_update
"okay, did I tell you my favorite food?",memory_retrieval
"Buddy, turn ninety degrees right.",movement
Remember I am working on a chatbot.,memory_update
quick question: can you recall the note about the soccer ball?,memory_retrieval
Move farther.,movement
Can you move like two steps back?,movement
"okay, i am bored, talk to me about food.",chat
"okay, follow me down the aisle.",movement
quick question: what food did I tell you I like?,memory_retrieval
"hey, i need you to reposition near the table.",movement
Do you know whether I like debugging hints?,memory_retrieval
Where did I leave my robot manual?,memory_retrieval
Who made you?,memory_retrieval
Remember that my laptop is on the desk.,memory_update
Rotate ninety degrees left one step.,movement
"okay, which direction did I say the exit was?",memory_retrieval
"hey, can you recall the note about the sketchbook?",memory_retrieval
Advance three small steps.,movement
Go backward.,movement
Can you pull up my memory?,memory_retrieval
I am your operator.,memory_update
quick question: which room did I say this was?,memory_retrieval
"um, rotate left .",movement
"From now on, if I ask about math, give me step-by-step explanations.",memory_update
"hey, can you list my saved notes?",memory_retrieval
"please, face toward the hallway .",movement
Do you like Twitch or VSCode better?,chat
"hey, log this: my current project is about intent classification.",memory_update
"yo, where is the camera?",memory_retrieval
Save that the emergency exit is near the lobby.,memory_update
"For future chats, use simple explanations.",memory_update
Keep in mind that I am learning soccer.,memory_update
"okay, what should you call me?",memory_retrieval
"for a second, face left carefully.",movement
Can you make a silly sentence about a dog?,chat
You should know that I prefer more intuition.,memory_update
What IDE do I use?,memory_retrieval
Advance gently.,movement
"okay, can you list my saved notes?",memory_retrieval
Line yourself up with the charging station.,movement
"hey, did I tell you my favorite food?",memory_retrieval
Walk farther.,movement
quick question: what is my favorite animal?,memory_retrieval
"yo, where did I leave my USB drive?",memory_retrieval
Follow me down the lab path.,movement
Can you move away from me gently?,movement
"okay, where did I leave my sketchbook?",memory_retrieval
Take a small step toward the exit.,movement
"yo, where did I leave my jacket?",memory_retrieval
"okay, what did I tell you about the previous room?",memory_retrieval
What do you think about school?,chat
"hey, reverse just a bit.",movement
quick question: what's my name again?,memory_retrieval
"hey, update my favorite social platform to VSCode.",memory_update
"The laptop is on the left shelf, keep that in memory.",memory_update
Can you move like one tile back?,movement
"yo, please clear the doorway.",movement
Rotate around in a straight line.,movement
"bro, can you move to the charging station one step?",movement
"okay, what did I tell you about Instagram?",memory_retrieval
BELT should remember that Jordan likes Terraria.,memory_update
"hey, where is the notebook?",memory_retrieval
"Yo, turn toward the hallway.",movement
"hey, which room did I say this was?",memory_retrieval
"Go check out the previous room, then come back.",movement
Follow me down the aisle.,movement
Rotate toward the whiteboard.,movement
"If a dolphin learned Python, what would it build?",chat
Can you compare Terraria and Valorant?,chat
quick question: what did I tell you about Instagram?,memory_retrieval
quick question: store this preference: I like math after intuition.,memory_update
"okay, can you recall the note about the phone charger?",memory_retrieval
quick question: where is the soccer ball?,memory_retrieval
Can you compare Minecraft and Geometry Dash?,chat
Do not forget that I like pasta after coding sessions.,memory_update
quick question: call me Jordan from now on.,memory_update
Remember this room is the classroom.,memory_update
"okay, can you recall the note about the jacket?",memory_retrieval
"okay, what location did I tell you to remember?",memory_retrieval
"okay, save that the emergency exit is behind us.",memory_update
Advance at normal speed.,movement
Note for later: I want BELT to be friendly.,memory_update
Rotate toward the hallway for a few seconds.,movement
"hey, what did you save about my laptop?",memory_retrieval
Do you like YouTube or YouTube better?,chat
Reverse slowly.,movement
Can you explain Python like I am new to it?,chat
quick question: what should I name my robot assistant?,chat
do you play games,chat
I need you to reposition near the window.,movement
"yo, if a cat learned Python, what would it build?",chat
"My favorite food is sandwiches, remember that.",memory_update
Tell me a tiny fun fact about food.,chat
Save that I prefer short robot responses.,memory_update
Remember when we talked about soccer? That was funny.,chat
"Robot, turn a little right.",movement
Remember when we talked about games? That was funny.,chat
Back up slowly.,movement
"Robot, turn toward the hallway.",movement
Do you like VSCode or Spotify better?,chat
quick question: can you pull up my memory?,memory_retrieval
Put in memory that I prefer Java for projects.,memory_update
What game did I say I play?,memory_retrieval
"quick question: from now on, if I ask about math, give me visual analogies.",memory_update
Can you move to the charging station a little bit?,movement
Please go farther without rushing.,movement
"okay, can you make a silly sentence about a wolf?",chat
"My favorite food is bagels, remember that.",memory_update
"Which is cooler, Snapchat or Reddit?",chat
do you play games real quick?,chat
Roll toward me.,movement
Move into the hallway.,movement
"From now on, explain things with examples first.",memory_update
"hey, what IDE do I use?",memory_retrieval
"okay, hey bestie",chat
"yo, remember when we talked about memes? That was funny.",chat
"Instagram is my favorite social platform, just so you know.",memory_update
"yo, where is the USB drive?",memory_retrieval
Remember to come back to the classroom.,memory_update
Scoot left smoothly.,movement
Note for later: I want BELT to be patient.,memory_update
"yo, can you recall the note about the phone charger?",memory_retrieval
"If a hamster learned Python, what would it build?",chat
what's up!,chat
"I am bored, talk to me about soccer.",chat
Do you like Pinterest or GitHub better?,chat
Remember this room is the computer lab.,memory_update
Can you compare Geometry Dash and Among Us?,chat
"Go check the hallway, then return here.",movement
Do you like Snapchat or VSCode better?,chat
I am your trainer.,memory_update
Drive forward.,movement
"I am bored, talk to me about Minecraft.",chat
Change my preferred editor to Visual Studio.,memory_update
Add to my notes that I play Honkai Star Rail.,memory_update
Can you compare Mario Kart and Mario Kart?,chat
Please remember to come back to this room.,memory_update
"I am bored, talk to me about math.",chat
Let's move on to the next example.,chat
Reverse like two feet.,movement
"yo, freeze for a second.",movement
"The ID card is on the left shelf, keep that in memory.",memory_update
Rotate toward the hallway without rushing.,movement
quick question: go right.,movement
Can you move like half a meter right?,movement
"hey, store this preference: I like plain English.",memory_update
Can you move farther slowly?,movement
What is the difference between RAM and a model?,chat
Can you compare Pokemon and Mario Kart?,chat
Where is the phone charger?,memory_retrieval
"I am bored, talk to me about YouTube.",chat
Did I tell you my favorite color?,memory_retrieval
"hey, what note did I leave about coming back?",memory_retrieval
"hey, where did I leave my notebook?",memory_retrieval
"okay, can you recall the note about the sketchbook?",memory_retrieval
"actually, turn toward the whiteboard .",movement
Please remember that the ID card is inside my backpack.,memory_update
"for a second, can you roll closer smoothly?",movement
Remember to come back to the main lobby.,memory_update
"hey, if a turtle learned Python, what would it build?",chat
Can you compare Valorant and Brawl Stars?,chat
Have you ever heard of Brawl Stars?,chat
quick question: where is the laptop?,memory_retrieval
"yo, what did you save about my backpack?",memory_retrieval
how do robots work,chat
Can you move away from me like two feet?,movement
"real quick, face toward the whiteboard please.",movement
quick question: where is the nearest emergency exit?,memory_retrieval
"Hi BELT, do you like YouTube or TikTok more?",chat
Where did I leave my jacket?,memory_retrieval
quick question: bELT should remember that Casey likes Mario Kart.,memory_update
quick question: do you remember where the nearest exit is?,memory_retrieval
Move beside the desk.,movement
I moved my code earlier and now I cannot find it.,chat
Roll beside the desk.,movement
"The soccer ball is on the table, keep that in memory.",memory_update
Move right.,movement
quick question: what did you save about my explanation style?,memory_retrieval
My favorite IDE is PyCharm.,memory_update
Keep in mind that I am learning calculus.,memory_update
"yo, what saved details do you have for me?",memory_retrieval
Scoot closer at normal speed.,movement
"I am bored, talk to me about weather.",chat
quick question: tell me a tiny fun fact about space.,chat
Tell me a tiny fun fact about coding.,chat
Do you remember where the nearest exit is?,memory_retrieval
I need you to reposition near the printer.,movement
What is the difference between memory and a hard drive?,chat
"The calculator is on the desk, keep that in memory.",memory_update
"okay, did I tell you my favorite platform?",memory_retrieval
"For future chats, use short answers.",memory_update
Can you compare Among Us and Terraria?,chat
Remember when we talked about robots? That was funny.,chat
"Which is cooler, Duolingo or Google Docs?",chat
"yo, did I tell you my favorite color?",memory_retrieval
quick question: what did I tell you about the hallway?,memory_retrieval
"Go check the charging spot, then return here.",movement
"okay, please, turn toward the whiteboard please.",movement
Remember that my favorite animal is a dolphin.,memory_update
Do you like Twitch or Canva better?,chat
"hey BELT, face ninety degrees right real quick.",movement
quick question: what location did I tell you to remember?,memory_retrieval
Can you chat with me for a minute?,chat
I am your debugger.,memory_update
Advance slowly.,movement
BELT should remember that Sam likes Pokemon.,memory_update
"hey, where is the planner?",memory_retrieval
Remember when we talked about coding? That was funny.,chat
can you tell a joke?,chat
"yo, where is the planner?",memory_retrieval
"okay, where did I leave my soccer ball?",memory_retrieval
Make a note that I use VSCode for coding.,memory_update
Tell me a tiny fun fact about games.,chat
Move away from me like two feet.,movement
Do not forget that I like pizza after coding sessions.,memory_update
"The calculator is by the window, keep that in memory.",memory_update
Save that my favorite game is Valorant.,memory_update
Can you make a silly sentence about a dragonfly?,chat
"yo, did I tell you my favorite food?",memory_retrieval
"okay, what note did I leave about coming back?",memory_retrieval
"okay, follow me down the hallway.",movement
"okay, who made you?",memory_retrieval
Please remember that the planner is next to the printer.,memory_update
Save that I left the robot manual on the table.,memory_update
quick question: where did I leave my phone charger?,memory_retrieval
"When you finish moving, return to the classroom.",memory_update
Can you recall the note about the backpack?,memory_retrieval
Can you move left just a bit?,movement
Return to the charging station.,movement
quick question: what kind of explanations do I prefer?,memory_retrieval
Which room did I say this was?,memory_retrieval
"okay, where is the planner?",memory_retrieval
Can you stay here and answer questions?,chat
quick question: where did I leave my laptop?,memory_retrieval
Back up a couple steps.,movement
"okay, how would you describe yourself as a campus robot?",chat
Update my favorite social platform to Google Docs.,memory_update
"okay, drive to the charging station.",movement
"yo, what kind of explanations do I prefer?",memory_retrieval
quick question: where did I leave my calculator?,memory_retrieval
Let's move on to the next question.,chat
Move to the nearest emergency exit if it is safe.,movement
"hey, what do you think about cats?",chat
What is a good beginner project with Python?,chat
Where is the robot manual?,memory_retrieval
What is your favorite animal?,chat
Move toward me.,movement
"The laptop is on the table, keep that in memory.",memory_update
quick question: do you know my nickname?,memory_retrieval
"hey BELT, can you walk to the door a little bit?",movement
Add to my notes that I play Chess.,memory_update
Please remember that the USB drive is at the front desk.,memory_update
Do you know whether I like math details?,memory_retrieval
"I prefer being called Bella, please remember.",memory_update
what does BELT stand for,chat
Put in memory that I prefer C++ for projects.,memory_update
My favorite IDE is Colab.,memory_update
"hey, face me.",movement
belt should remember that Kai likes Honkai Star Rail.,memory_update
Can you help me write a sentence about computer vision?,chat
Roll to the charging station.,movement
Save that I left the sketchbook under the chair.,memory_update
"okay, what food did I tell you I like?",memory_retrieval
Rotate ninety degrees right one step.,movement
Can you help me brainstorm a project about algorithms?,chat
"yo, what note did I leave about coming back?",memory_retrieval
quick question: where is the calculator?,memory_retrieval
quick question: where did I leave my jacket?,memory_retrieval
Do you like Snapchat or Twitch better?,chat
"yo, where is the water bottle?",memory_retrieval
Can you move closer smoothly?,movement
"hey, where is the robot manual?",memory_retrieval
"Which is cooler, Twitch or Twitch?",chat
"yo, who made you?",memory_retrieval
Save that I left the phone charger under the chair.,memory_update
"I am bored, talk to me about cats.",chat
Go around the backpack.,movement
quick question: freeze for a second.,movement
Come closer a couple steps.,movement
Save that my favorite game is Celeste.,memory_update
"hey, where is the phone charger?",memory_retrieval
Put in memory that I prefer MATLAB for projects.,memory_update
Do you know whether I like short answers?,memory_retrieval
Please go right slowly.,movement
"from now on, if I ask about math, give me debugging hints.",memory_update
quick question: put in memory that I prefer Scratch for projects.,memory_update
can you talk?,chat
Have you ever heard of Tetris?,chat
"hey, where is the soccer ball?",memory_retrieval
"yo, go check the hallway, then return here.",movement
Pause right there.,movement
Save that I left the USB drive inside my backpack.,memory_update
"hey, what did I say my current project was?",memory_retrieval
Save that I left the ID card on the table.,memory_update
Move away from me.,movement
"The USB drive is beside the whiteboard, keep that in memory.",memory_update
"BELT, turn toward the whiteboard.",movement
quick question: where is the sketchbook?,memory_retrieval
