text,intent
quick question: can you stay here and answer questions?,chat
Roll away from me.,movement
Note that my favorite app is Canva.,memory_update
Can you recall the note about the planner?,memory_retrieval
Do you like Pinterest or Discord better?,chat
Can you move to the charging station without rushing?,movement
"yo, face toward the whiteboard real quick.",movement
"yo, where did I leave my robot manual?",memory_retrieval
"okay, where did I leave my headphones?",memory_retrieval
Have you ever heard of Mario Kart?,chat
"Which is cooler, Reddit or TikTok?",chat
quick question: do you know whether I like simple explanations?,memory_retrieval
"hey, what did you save about my favorite app?",memory_retrieval
What do you think about coding?,chat
quick question: move to the nearest emergency exit slowly.,movement
"hey, do you know whether I like simple explanations?",memory_retrieval
Make a note that I use Sublime Text for coding.,memory_update
Can you compare Valorant and Among Us?,chat
"hey, where did I leave my calculator?",memory_retrieval
"okay, what did you save about my charger?",memory_retrieval
Log this: my current project is about voice interaction.,memory_update
save this detail: I like Python.,memory_update
Show my saved memory.,memory_retrieval
Please go backward just a bit.,movement
quick question: save this detail: I like Minecraft lore.,memory_update
Remember this room is the charging area.,memory_update
"My favorite food is ramen, remember that.",memory_update
"My favorite food is noodles, remember that.",memory_update
Go around the table.,movement
"yo, can you recall the note about the USB drive?",memory_retrieval
"I prefer being called Chris, please remember.",memory_update
quick question: did I tell you my favorite platform?,memory_retrieval
"yo, what IDE do I use?",memory_retrieval
"hey, where did I leave my sketchbook?",memory_retrieval
What is the difference between RAM and thinking?,chat
"I prefer being called Alex, please remember.",memory_update
Please remember that the laptop is next to the couch.,memory_update
Do not forget that I like sushi after coding sessions.,memory_update
Please remember that the USB drive is by the window.,memory_update
quick question: call me Avery from now on.,memory_update
Can you move toward the exit smoothly?,movement
Remember my nickname is TJ.,memory_update
"okay, did I tell you my favorite color?",memory_retrieval
Go into the hallway.,movement
What did you save about my favorite app?,memory_retrieval
what's up buddy,chat
Can you explain algorithms like I am new to it?,chat
"hey, what's my name again?",memory_retrieval
"hey, what did I ask you to remember?",memory_retrieval
"yo, how does a robot know where it is?",chat
Roll right.,movement
Can you compare Fortnite and Mario Kart?,chat
Can you make a silly sentence about a capybara?,chat
Back up like two feet.,movement
Keep in mind that I am learning PCA.,memory_update
I am your creator.,memory_update
Can you recall the note about the sketchbook?,memory_retrieval
Where is the calculator?,memory_retrieval
"when you can, can you roll right at normal speed?",movement
Do you remember my favorite game?,memory_retrieval
"hey, where is the USB drive?",memory_retrieval
Can you explain creative writing like I am new to it?,chat
"hey, where is the headphones?",memory_retrieval
Save that I left the ID card at the front desk.,memory_update
Make a note that I use Replit for coding.,memory_update
quick question: can you recall the note about the phone charger?,memory_retrieval
"okay, do you know whether I like short answers?",memory_retrieval
BELT should remember that Jordan likes Celeste.,memory_update
"Which is cooler, GitHub or Pinterest?",chat
Update my favorite social platform to Pinterest.,memory_update
"Hello world, robot edition.",chat
I need to save my plot before it crashes.,chat
"real quick, can you drive closer gently?",movement
What is your favorite song genre?,chat
What is a good beginner project with Arduino?,chat
Go around the cart.,movement
"If a wolf learned Python, what would it build?",chat
Please remember that the calculator is in the previous room.,memory_update
what is machine learning,chat
"okay, where is the camera?",memory_retrieval
advance smoothly.,movement
"okay, can you move like half a meter forward?",movement
Go toward the exit.,movement
good evening!,chat
BELT should remember that Maya likes Valorant.,memory_update
"okay, can you recall the note about the camera?",memory_retrieval
"hey, where did I leave my ID card?",memory_retrieval
Remember when we talked about AI? That was funny.,chat
"bestie, can you walk right one step?",movement
Remember that my favorite animal is a wolf.,memory_update
"hey, i need to save my model before it crashes.",chat
"okay, what did you save about my favorite app?",memory_retrieval
Go around the desk.,movement
"yo, what is my favorite color?",memory_retrieval
Please remember that the phone charger is beside the whiteboard.,memory_update
What was the thing I asked you not to forget?,memory_retrieval
Navigate toward the stairwell.,movement
"yo, for future chats, use more intuition.",memory_update
What do you think about space?,chat
"okay, where did I leave my USB drive?",memory_retrieval
hello buddy,chat
Can you recall the note about the camera?,memory_retrieval
Can you move toward me a little bit?,movement
Advance a couple steps.,movement
Remember this room is the main lobby.,memory_update
quick question: my favorite color is red.,memory_update
what can you do real quick?,chat
"yo, i usually want answers about machine learning to be visual.",memory_update
I usually want answers about algorithms to be example-driven.,memory_update
Do you like Snapchat or Notion better?,chat
Call me Casey from now on.,memory_update
Remember that my favorite club topic is algorithms.,memory_update
Do you like Instagram or YouTube better?,chat
Remember that my favorite animal is a capybara.,memory_update
Please remember that the USB drive is on the left shelf.,memory_update
What do you think about cats?,chat
Note for later: I want BELT to be slightly witty.,memory_update
Drive toward the exit.,movement
"hey, freeze for a second.",movement
My favorite IDE is Arduino IDE.,memory_update
"yo, what did you save about my laptop?",memory_retrieval
"The sketchbook is under the chair, keep that in memory.",memory_update
Rotate left a little bit.,movement
Note that my favorite app is Duolingo.,memory_update
Move to the nearest emergency exit.,movement
Log this: my current project is about campus navigation.,memory_update
"BELT, turn ninety degrees right.",movement
I usually want answers about PCA to be visual.,memory_update
"yo, go check the charging spot, then return here.",movement
Have you ever heard of Chess?,chat
"hey, what did you save about my backpack?",memory_retrieval
"hey, can you recall the note about the backpack?",memory_retrieval
Scoot right a couple steps.,movement
Save that my favorite game is Tetris.,memory_update
Rotate a little right like two feet.,movement
"hey, can you help me brainstorm a project about machine learning?",chat
"okay, can you help me write a sentence about AI safety?",chat
Come closer smoothly.,movement
Back up two steps.,movement
"yo, shift backward gently.",movement
quick question: can you recall the note about the sketchbook?,memory_retrieval
"okay, can you recall the note about the backpack?",memory_retrieval
"hey, can you pull up my memory?",memory_retrieval
Keep in mind that I am learning robotics.,memory_update
"okay, where is the headphones?",memory_retrieval
Drive right.,movement
Please remember that the water bottle is near the charging station.,memory_update
"The notebook is beside the whiteboard, keep that in memory.",memory_update
"When you finish moving, return to the charging area.",memory_update
"Back up slowly, please.",movement
Do you like TikTok or Canva better?,chat
"Which is cooler, Snapchat or Snapchat?",chat
scoot away gently.,movement
Advance a little bit.,movement
Move away from me at normal speed.,movement
Remember I am working on a machine learning demo.,memory_update
You should know that I prefer simple explanations.,memory_update
I usually want answers about calculus to be short.,memory_update
Scoot right gently.,movement
Turn so your front is facing the hallway.,movement
quick question: what did you save about my laptop?,memory_retrieval
What is the difference between a file and a list?,chat
Come closer three small steps.,movement
can you compare Honkai Star Rail and Geometry Dash?,chat
quick question: where did I leave my notebook?,memory_retrieval
What do you think about food?,chat
That movie was actually pretty good.,chat
quick question: tell me what you know about my preferences.,memory_retrieval
Park next to the door.,movement
quick question: go beside the desk.,movement
"yo, where did I leave my backpack?",memory_retrieval
"hey, did I tell you my favorite animal?",memory_retrieval
"yo, what did you save about my project?",memory_retrieval
quick question: show my saved memory.,memory_retrieval
Remember to come back to the stairwell.,memory_update
"I am bored, talk to me about coding.",chat
quick question: go to the charging station.,movement
Rotate toward me just a bit.,movement
Do you like Google Docs or Reddit better?,chat
I usually want answers about Python to be visual.,memory_update
Remember when we talked about school? That was funny.,chat
"hey, do you remember where the nearest exit is?",memory_retrieval
Can you help me brainstorm a project about data science?,chat
"yo, let's move on to the next example.",chat
"hey, stop moving.",movement
Back up for a few seconds.,movement
"I am bored, talk to me about games.",chat
Can you recall the note about the water bottle?,memory_retrieval
"yo, where is the headphones?",memory_retrieval
"yo, what should you call me?",memory_retrieval
"My favorite food is curry, remember that.",memory_update
"okay, can you drive toward the exit three small steps?",movement
Please remember that the planner is by the window.,memory_update
Advance carefully.,movement
BELT should remember that Avery likes Tetris.,memory_update
Add to my notes that I play Mario Kart.,memory_update
Do you like Canva or Discord better?,chat
"okay, where did I leave my water bottle?",memory_retrieval
Where did I leave my soccer ball?,memory_retrieval
can you explain PCA,chat
Walk with me to the hallway.,movement
Please go toward the exit carefully.,movement
Reverse three small steps.,movement
Have you ever heard of Among Us?,chat
Move to the door.,movement
"hey, what preferences have you saved for me?",memory_retrieval
hello robot,chat
Can you check out the previous room and come back?,movement
Walk with me to the computer lab.,movement
"hey, what is my favorite animal?",memory_retrieval
"Which is cooler, Spotify or Spotify?",chat
"hey, i moved my file earlier and now I cannot find it.",chat
Turn so your front is facing the desk.,movement
"yo, what do you remember about me?",memory_retrieval
Please remember that the backpack is at the front desk.,memory_update
"My favorite food is pho, remember that.",memory_update
"hey, did I tell you my favorite game?",memory_retrieval
belt should remember that Luna likes Roblox.,memory_update
Remember that my favorite animal is a turtle.,memory_update
Note for later: I want BELT to be curious.,memory_update
Which room were you supposed to return to?,memory_retrieval
Did I tell you my favorite platform?,memory_retrieval
how are you,chat
"okay, do you know my nickname?",memory_retrieval
Shift left a little bit.,movement
"please, can you drive forward two steps?",movement
Tell me a tiny fun fact about dogs.,chat
"yo, who is your creator?",memory_retrieval
"okay, where did I leave my planner?",memory_retrieval
Remember when we talked about math? That was funny.,chat
Move to the nearest emergency exit slowly.,movement
Can you help me write a sentence about algorithms?,chat
What is my favorite color?,memory_retrieval
"yo, yo buddy",chat
Do not forget that I like fried rice after coding sessions.,memory_update
I usually want answers about soccer to be step-by-step.,memory_update
Turn so your front is facing the exit.,movement
Go right.,movement
Drive backward.,movement
"Which is cooler, Pinterest or GitHub?",chat
Walk toward the exit.,movement
Come closer two steps.,movement
Scoot forward for a few seconds.,movement
"okay, where did I leave my robot manual?",memory_retrieval
"hey, can you recall the note about the planner?",memory_retrieval
"Which is cooler, TikTok or Canva?",chat
"I prefer being called Jamie, please remember.",memory_update
"yo, what do you think about games?",chat
"hey, i am your programmer.",memory_update
good morning,chat
Which app did I say I liked most?,memory_retrieval
Remember this room is the front office.,memory_update
Return to the starting point.,movement
quick question: what did you save about my favorite app?,memory_retrieval
What did you save about my backpack?,memory_retrieval
"hey, turn a little left.",movement
"okay, where is the nearest emergency exit?",memory_retrieval
Come closer like two feet.,movement
Back up three small steps.,movement
"The phone charger is in the previous room, keep that in memory.",memory_update
Scoot back like two feet.,movement
Do you like Reddit or GitHub better?,chat
BELT should remember that Sam likes Celeste.,memory_update
Please go away from me without rushing.,movement
"The soccer ball is inside my backpack, keep that in memory.",memory_update
"Which is cooler, VSCode or Canva?",chat
Can you make a silly sentence about a red panda?,chat
"yo, let's move on to another topic.",chat
Where is the backpack?,memory_retrieval
"The ID card is by the window, keep that in memory.",memory_update
Add to my notes that I play Brawl Stars.,memory_update
"yo, where did I leave my ID card?",memory_retrieval
Please remember that the phone charger is under the chair.,memory_update
"BELT, turn around.",movement
Do you like Spotify or Canva better?,chat
Remember to come back to the club room.,memory_update
What is your favorite game?,chat
Remember that my favorite club topic is AI safety.,memory_update
Remember that my favorite club topic is data science.,memory_update
"I prefer being called Luna, please remember.",memory_update
Make a note that I use Eclipse for coding.,memory_update
"okay, remember when we talked about music? That was funny.",chat
Take a small step toward the hallway.,movement
Can you move to the previous room a couple steps?,movement
Where is the ID card?,memory_retrieval
Can you compare Honkai Star Rail and Fortnite?,chat
"okay, where is the notebook?",memory_retrieval
"yo, store this preference: I like visual analogies.",memory_update
"If a red panda learned Python, what would it build?",chat
What does the word classifier mean?,chat
Please go backward a little bit.,movement
My favorite color is silver.,memory_update
Move away from me for a few seconds.,movement
Do you know anything about Brawl Stars?,chat
"okay, what is the difference between memory and a list?",chat
Scoot closer carefully.,movement
"yo, what food did I tell you I like?",memory_retrieval
Add to my notes that I play Roblox.,memory_update
BELT should remember that Chris likes Fortnite.,memory_update
Remember this room is the workshop.,memory_update
"hey, what did I tell you about the hallway?",memory_retrieval
"hey, do you know my nickname?",memory_retrieval
"okay, where is the phone charger?",memory_retrieval
quick question: do you know whether I like debugging hints?,memory_retrieval
"Buddy, turn counterclockwise.",movement
Advance without rushing.,movement
Remember my nickname is Bean.,memory_update
Drive left.,movement
Go to the hallway.,movement
Keep in mind that I am learning linear algebra.,memory_update
"yo, can you recall the note about the headphones?",memory_retrieval
My favorite IDE is Replit.,memory_update
"yo, what room are we supposed to return to?",memory_retrieval
"My favorite food is sushi, remember that.",memory_update
What's my name again?,memory_retrieval
Can you explain game design like I am new to it?,chat
Call me Riley from now on.,memory_update
Can you recall the note about the USB drive?,memory_retrieval
Save that my favorite game is Geometry Dash.,memory_update
"When you finish moving, return to the previous room.",memory_update
"For future chats, use direct feedback.",memory_update
Remember I am working on a campus robot.,memory_update
What is your favorite snack?,chat
"For future chats, use examples first.",memory_update
Remember when we talked about Minecraft? That was funny.,chat
"yo, i am bored, talk to me about dogs.",chat
Remember to come back to the library.,memory_update
"okay, add to my notes that I play Geometry Dash.",memory_update
Turn so your front is facing the door.,movement
"okay, what did I tell you about VSCode?",memory_retrieval
"yo, i usually want answers about creative writing to be visual.",memory_update
hi bestie,chat
"okay, what preferences have you saved for me?",memory_retrieval
Where did I leave my backpack?,memory_retrieval
Go left.,movement
quick question: where did I leave my backpack?,memory_retrieval
Remember I am working on an intent router.,memory_update
quick question: remember when we talked about coding? That was funny.,chat
Can you move like half a meter forward?,movement
You should know that I prefer visual analogies.,memory_update
Where is the laptop?,memory_retrieval
What is the difference between storage and learning?,chat
Save this detail: I like game design.,memory_update
Navigate toward the main lobby.,movement
"My favorite food is mangoes, remember that.",memory_update
Walk forward.,movement
quick question: move away from me a couple steps.,movement
"uh, can you move to the charging station just a bit?",movement
Come closer one step.,movement
"I am bored, talk to me about AI.",chat
Please remember that the planner is in the lab.,memory_update
Drive toward me.,movement
Can you give me a quick pep talk before I code?,chat
"yo, for future chats, use plain English.",memory_update
"bestie, can you drive right for a few seconds?",movement
quick question: what did I tell you about Brawl Stars?,memory_retrieval
Where did I leave my planner?,memory_retrieval
quick question: do you know whether I like short answers?,memory_retrieval
hello,chat
"okay, show my saved memory.",memory_retrieval
"hey, turn so your front is facing the hallway.",movement
Do you like Canva or Google Docs better?,chat
What is the difference between storage and thinking?,chat
Can you help me brainstorm a project about PCA?,chat
I usually want answers about robotics to be example-driven.,memory_update
Please go backward like two feet.,movement
"Which is cooler, Duolingo or Pinterest?",chat
hello BELT,chat
Do you like Twitch or Instagram better?,chat
Back up one step.,movement
Note for later: I want BELT to be concise.,memory_update
"okay, do you know whether I like examples?",memory_retrieval
Drive to the charging station.,movement
quick question: my favorite color is navy.,memory_update
Park next to the desk.,movement
Park next to the table.,movement
Back up just a bit.,movement
"hey, how does a robot know where it is?",chat
What did I tell you about the hallway?,memory_retrieval
Scoot away a little bit.,movement
Please go left carefully.,movement
"hey, can you recall the note about the notebook?",memory_retrieval
quick question: take a small step toward the door.,movement
"yo, what did I tell you about Instagram?",memory_retrieval
"okay, what did I ask you to remember?",memory_retrieval
"yo, what's my name again?",memory_retrieval
Can you move like two steps right?,movement
"From now on, if I ask about math, give me visual analogies.",memory_update
Please go right three small steps.,movement
"like, can you walk farther slowly?",movement
Update my favorite social platform to TikTok.,memory_update
"If a axolotl learned Python, what would it build?",chat
"yo, do you remember where the nearest exit is?",memory_retrieval
Remember to come back to the hallway.,memory_update
"okay, can you recall the note about the robot manual?",memory_retrieval
quick question: can you explain machine learning like I am new to it?,chat
"hey, can you give me a quick pep talk before I code?",chat
"uh, can you roll left in a straight line?",movement
Rotate a little right slowly.,movement
Go to the door.,movement
Reverse smoothly.,movement
Move backward.,movement
"hey, can you recall the note about the water bottle?",memory_retrieval
"Belt, turn toward the hallway.",movement
Can you move to the door three small steps?,movement
Can you compare Brawl Stars and Chess?,chat
"I am bored, talk to me about Brawl Stars.",chat
"I prefer being called Tian, please remember.",memory_update
I usually want answers about computer vision to be short.,memory_update
"From now on, if I ask about math, give me beginner-friendly explanations.",memory_update
Update my favorite social platform to Discord.,memory_update
"yo, tell me what you know about my preferences.",memory_retrieval
"Which is cooler, YouTube or YouTube?",chat
Where did I leave my camera?,memory_retrieval
"yo, change my preferred editor to Cursor.",memory_update
"yo, rotate toward me please.",movement
"yo, shift backward a couple steps.",movement
"okay, where did I leave my notebook?",memory_retrieval
quick question: did I tell you my favorite animal?,memory_retrieval
quick question: what preferences have you saved for me?,memory_retrieval
"bro, turn a little right please.",movement
hey bestie,chat
Save that I left the phone charger in the previous room.,memory_update
Rotate toward me for a few seconds.,movement
quick question: where is the phone charger?,memory_retrieval
"yo, where did I leave my camera?",memory_retrieval
"yo, do you know whether I like math details?",memory_retrieval
What do you think about AI?,chat
"okay, tell me what you know about my preferences.",memory_retrieval
what does BELT stand for!,chat
Come closer a little bit.,movement
"hey, did I tell you my favorite IDE?",memory_retrieval
"like, can you drive around carefully?",movement
Reverse for a few seconds.,movement
quick question: move away from me in a straight line.,movement
Do you like Reddit or Spotify better?,chat
"hey, where is the sketchbook?",memory_retrieval
"I am bored, talk to me about space.",chat
quick question: what note did I leave about coming back?,memory_retrieval
"The backpack is by the window, keep that in memory.",memory_update
"From now on, if I ask about math, give me math after intuition.",memory_update
"yo, do you know whether I like short answers?",memory_retrieval
"if it is safe, can you walk right just a bit?",movement
quick question: who is your creator?,memory_retrieval
do you know any fun facts?,chat
Where did I leave my headphones?,memory_retrieval
Please go toward the exit just a bit.,movement
"If a penguin learned Python, what would it build?",chat
BELT should remember that Taylor likes Celeste.,memory_update
"Which is cooler, Discord or Snapchat?",chat
"okay, where is the water bottle?",memory_retrieval
quick question: what IDE do I use?,memory_retrieval
"The ID card is next to the printer, keep that in memory.",memory_update
You should know that I prefer debugging hints.,memory_update
Update my favorite social platform to Instagram.,memory_update
"hey, pause right there.",movement
Did I tell you my favorite animal?,memory_retrieval
hey bestie.,chat
Can you compare Tetris and Pokemon?,chat
I usually want answers about AI safety to be short.,memory_update
"Which is cooler, YouTube or Snapchat?",chat
Remember to come back to the meeting room.,memory_update
I am your programmer.,memory_update
"okay, can you recall the note about the calculator?",memory_retrieval
Can you help me write a sentence about AI safety?,chat
Scoot left slowly.,movement
"Which is cooler, Reddit or YouTube?",chat
good morning!,chat
Can you explain PCA like I am new to it?,chat
"yo, what game did I say I play?",memory_retrieval
"okay, did I tell you my favorite IDE?",memory_retrieval
Take a small step toward the desk.,movement
Call me Bella during this project.,memory_update
Can you compare Geometry Dash and Geometry Dash?,chat
"hey, what did I tell you about Instagram?",memory_retrieval
quick question: can you recall the note about the planner?,memory_retrieval
Log this: my current project is about robot memory.,memory_update
"yo, can you explain PCA?",chat
"yo, can you recall the note about the robot manual?",memory_retrieval
Make a note that I use Colab for coding.,memory_update
Can you move to the door a little bit?,movement
"okay, who is your creator?",memory_retrieval
"Which is cooler, VSCode or Spotify?",chat
Walk backward.,movement
sup robot,chat
Freeze for a second.,movement
Save that I left the robot manual next to the printer.,memory_update
Can you help me brainstorm a project about soccer?,chat
"yo, which direction did I say the exit was?",memory_retrieval
"Which is cooler, Duolingo or GitHub?",chat
quick question: where is the ID card?,memory_retrieval
Return to the previous room.,movement
Remember this room is the meeting room.,memory_update
"yo, what location did I tell you to remember?",memory_retrieval
Do you like Instagram or Reddit better?,chat
"okay, what game did I say I play?",memory_retrieval
Tell me what you know about my preferences.,memory_retrieval
"Which is cooler, Duolingo or Spotify?",chat
"hey, do you know whether I like examples?",memory_retrieval
"If a fox learned Python, what would it build?",chat
Where is the water bottle?,memory_retrieval
"for a second, turn around carefully.",movement
Do you like Twitch or YouTube better?,chat
Remember that my favorite animal is a axolotl.,memory_update
Call me Chris from now on.,memory_update
"hey, what's my favorite social platform?",memory_retrieval
"hey, where is the calculator?",memory_retrieval
Please go right one step.,movement
What kind of explanations do I prefer?,memory_retrieval
Do you like Discord or Pinterest better?,chat
