text,intent
Save this detail: I like machine learning.,memory_update
Can you make a silly sentence about a dolphin?,chat
good evening,chat
What does computer memory mean?,chat
Call me Jamie from now on.,memory_update
Scoot forward carefully.,movement
"hey, where is the backpack?",memory_retrieval
"okay, where is the soccer ball?",memory_retrieval
Note that the charger is next to the printer.,memory_update
Make a note that I use Atom for coding.,memory_update
"okay, what did I tell you about my laptop?",memory_retrieval
"yo, where did I leave my calculator?",memory_retrieval
Shift right just a bit.,movement
Keep in mind that I am learning data science.,memory_update
"okay, can you give me a quick pep talk before I code?",chat
Do you like TikTok or Twitch better?,chat
please clear the doorway.,movement
"yo, can you recall the note about the ID card?",memory_retrieval
I usually want answers about Minecraft lore to be step-by-step.,memory_update
"yo, where did I leave my water bottle?",memory_retrieval
"Hey, turn toward the whiteboard.",movement
"Go check the previous room, then return here.",movement
"hey, can you help me write a sentence about USACO?",chat
Can you explain robotics like I am new to it?,chat
What should you call me?,memory_retrieval
quick question: where did I leave my ID card?,memory_retrieval
Do not forget that I like mangoes after coding sessions.,memory_update
Remember when we talked about music? That was funny.,chat
what does BELT stand for?,chat
"hey, do you know whether I like debugging hints?",memory_retrieval
Do not forget that I like noodles after coding sessions.,memory_update
Remember when we talked about weather? That was funny.,chat
Put in memory that I prefer JavaScript for projects.,memory_update
Can you compare Valorant and Minecraft?,chat
Remember when we talked about memes? That was funny.,chat
"hey, did I tell you my favorite color?",memory_retrieval
Save that I left the water bottle near the hallway.,memory_update
My favorite color is green.,memory_update
"if it is safe, turn ninety degrees left carefully.",movement
Remember that my favorite club topic is machine learning.,memory_update
"okay, do you remember where the nearest exit is?",memory_retrieval
"The phone charger is under the chair, keep that in memory.",memory_update
Make a note that I use IntelliJ for coding.,memory_update
Where did I leave my notebook?,memory_retrieval
Return to the lab.,movement
"For future chats, use math after intuition.",memory_update
"BELT, turn toward me.",movement
What do you think about weather?,chat
"actually, can you walk right like two feet?",movement
Reverse one step.,movement
Can you move like half a meter left?,movement
what can you do,chat
yo!!,chat
"okay, what topic am I learning right now?",memory_retrieval
What do you think about soccer?,chat
"okay, go check the previous room, then return here.",movement
"The backpack is at the front desk, keep that in memory.",memory_update
Shift right one step.,movement
Move away from me one step.,movement
"okay, did I tell you my favorite animal?",memory_retrieval
What is the difference between storage and a hard drive?,chat
Go around the chair.,movement
Tell me a tiny fun fact about memes.,chat
Please remember that the headphones is on the left shelf.,memory_update
Please remember that the headphones is by the window.,memory_update
"for a second, can you roll forward gently?",movement
You should know that I prefer concise bullet points.,memory_update
"hey, where did I leave my water bottle?",memory_retrieval
What does the word token mean?,chat
quick question: what game did I say I play?,memory_retrieval
"When you finish moving, return to the meeting room.",memory_update
Do you like Duolingo or VSCode better?,chat
"okay, can you roll to the previous room smoothly?",movement
quick question: do you know whether I like math details?,memory_retrieval
Scoot left two steps.,movement
"I am bored, talk to me about memes.",chat
Remember that my favorite animal is a red panda.,memory_update
yo buddy,chat
"The calculator is in the lab, keep that in memory.",memory_update
Move away from me carefully.,movement
Remember I am working on a memory system.,memory_update
quick question: can you help me write a sentence about creative writing?,chat
Come closer in a straight line.,movement
quick question: what did you save about my project?,memory_retrieval
Shift left smoothly.,movement
"hey, what topic am I learning right now?",memory_retrieval
"hey, come closer a little bit.",movement
Let's move on to the next slide.,chat
Please go to the previous room two steps.,movement
What is the difference between a database and a model?,chat
Note that my favorite app is Pinterest.,memory_update
"I prefer being called Jordan, please remember.",memory_update
hey BELT,chat
"real quick, turn ninety degrees left please.",movement
I moved my code into a new file and now it broke.,chat
Can you recall the note about the jacket?,memory_retrieval
"I am bored, talk to me about dogs.",chat
"hey, where is the laptop?",memory_retrieval
"Which is cooler, VSCode or Google Docs?",chat
Remember this room is the club room.,memory_update
Remember when we talked about dogs? That was funny.,chat
Line yourself up with the desk.,movement
Can you move backward for a few seconds?,movement
"hey, what kind of explanations do I prefer?",memory_retrieval
Call me Taylor from now on.,memory_update
"Which is cooler, TikTok or Google Docs?",chat
Walk right.,movement
"yo, what did you save about my explanation style?",memory_retrieval
quick question: do you like YouTube or VSCode better?,chat
Can you compare Celeste and Brawl Stars?,chat
Who is your creator?,memory_retrieval
Please go toward me a little bit.,movement
Scoot back a couple steps.,movement
Can you compare Mario Kart and Among Us?,chat
What is your favorite robot movie?,chat
"The camera is on the table, keep that in memory.",memory_update
Rotate toward me without rushing.,movement
Can you make a silly sentence about a hamster?,chat
Please go into the hallway at normal speed.,movement
Remember this room is the library.,memory_update
"hey, please go into the hallway without rushing.",movement
Can you compare Tetris and Fortnite?,chat
Can you compare Honkai Star Rail and Valorant?,chat
Can you recall the note about the soccer ball?,memory_retrieval
Keep in mind that I am learning AI safety.,memory_update
Add to my notes that I play Geometry Dash.,memory_update
what is machine learning real quick?,chat
Store this preference: I like visual analogies.,memory_update
Move away from me a little bit.,movement
What do you remember about me?,memory_retrieval
"hey, what room are we supposed to return to?",memory_retrieval
Have you ever heard of Celeste?,chat
good evening!!,chat
What is a good beginner project with Streamlit?,chat
quick question: what did I ask you to remember?,memory_retrieval
Can you move like a couple feet right?,movement
Do not forget that I like burritos after coding sessions.,memory_update
Follow me down the hallway.,movement
Store this preference: I like plain English.,memory_update
"hey, where is the ID card?",memory_retrieval
"yo, what preferences have you saved for me?",memory_retrieval
Let's move on to debugging.,chat
Save that my favorite game is Roblox.,memory_update
Where is the USB drive?,memory_retrieval
Store this preference: I like math after intuition.,memory_update
Update my favorite social platform to Duolingo.,memory_update
Can you recall the note about the ID card?,memory_retrieval
"okay, what did you save about my project?",memory_retrieval
quick question: can you help me brainstorm a project about AI safety?,chat
Note that my favorite app is Snapchat.,memory_update
Scoot right just a bit.,movement
Tell me a random robotics fact.,chat
"okay, which room did I say this was?",memory_retrieval
Please remember that the ID card is on the desk.,memory_update
quick question: stop moving.,movement
Navigate toward the nearest exit.,movement
Did I tell you my favorite IDE?,memory_retrieval
"okay, where is the laptop?",memory_retrieval
Can you move to the previous room smoothly?,movement
Please go to the previous room in a straight line.,movement
My favorite IDE is Xcode.,memory_update
Can you compare Geometry Dash and Roblox?,chat
Move away from me three small steps.,movement
quick question: keep in mind that I am learning USACO.,memory_update
Can you help me write a sentence about USACO?,chat
yo robot,chat
Save this detail: I like algorithms.,memory_update
What programming language did I say I prefer?,memory_retrieval
Save that the emergency exit is behind us.,memory_update
"hey BELT, can you walk away from me a little bit?",movement
Do you like VSCode or Snapchat better?,chat
BELT should remember that Taylor likes Honkai Star Rail.,memory_update
My favorite color is navy.,memory_update
Can you help me write a sentence about data science?,chat
I moved my project folder earlier and now I cannot find it.,chat
Save that my favorite game is Terraria.,memory_update
Rotate a little right at normal speed.,movement
Remember that my favorite club topic is Minecraft lore.,memory_update
Drive into the hallway.,movement
My favorite color is teal.,memory_update
Have you ever heard of Fortnite?,chat
Store this preference: I like debugging hints.,memory_update
Where is the jacket?,memory_retrieval
Can you help me write a sentence about Minecraft lore?,chat
Tell me a tiny fun fact about books.,chat
Go to the lab table.,movement
"okay, make a note that I use Jupyter Notebook for coding.",memory_update
Can you help me brainstorm a project about robotics?,chat
quick question: what topic am I learning right now?,memory_retrieval
Shift backward slowly.,movement
"If a porcupine learned Python, what would it build?",chat
you should know that I prefer short answers.,memory_update
What do you think about Brawl Stars?,chat
Save that I left the soccer ball near the charging station.,memory_update
Have you ever heard of Geometry Dash?,chat
"I prefer being called Riley, please remember.",memory_update
"hey, what did I tell you about the previous room?",memory_retrieval
Where is the soccer ball?,memory_retrieval
"hey BELT, turn toward the hallway real quick.",movement
Can you move like a tiny bit back?,movement
"yo, where is the phone charger?",memory_retrieval
Scoot away smoothly.,movement
Reverse carefully.,movement
Walk left.,movement
Can you move closer without rushing?,movement
Follow me down the corridor.,movement
"Yo, can you turn right or something?",movement
"yo, can you recall the note about the jacket?",memory_retrieval
Can you explain linear algebra like I am new to it?,chat
Do you know whether I like simple explanations?,memory_retrieval
quick question: where is the jacket?,memory_retrieval
"BELT, turn counterclockwise.",movement
"hey, what object was I talking about earlier?",memory_retrieval
"okay, what kind of explanations do I prefer?",memory_retrieval
Can you compare Chess and Chess?,chat
What's my favorite social platform?,memory_retrieval
Reverse a couple steps.,movement
Walk closer.,movement
"yo, where did I leave my laptop?",memory_retrieval
how has your day been real quick?,chat
Move away from me slowly.,movement
Can you move beside the desk two steps?,movement
"hey, can you recall the note about the USB drive?",memory_retrieval
quick question: what object was I talking about earlier?,memory_retrieval
Save that my favorite game is Fortnite.,memory_update
Can you help me write a sentence about linear algebra?,chat
What is the difference between a file and a hard drive?,chat
"okay, can you drive into the hallway two steps?",movement
"I prefer being called Kai, please remember.",memory_update
what is the difference between AI and ML please?,chat
Remember my nickname is Ace.,memory_update
Remember when we talked about books? That was funny.,chat
Can you help me write a sentence about PCA?,chat
"yo, what do you think about school?",chat
"okay, can you recall the note about the soccer ball?",memory_retrieval
"For future chats, use visual analogies.",memory_update
"okay, can you recall the note about the water bottle?",memory_retrieval
"Buddy, turn toward me.",movement
"From now on, if I ask about math, give me concise bullet points.",memory_update
"If a cat learned Python, what would it build?",chat
"yo, add to my notes that I play Terraria.",memory_update
"okay, what do you remember about me?",memory_retrieval
"Move beside me, not in front of me.",movement
how are you?,chat
"My favorite food is dumplings, remember that.",memory_update
"hey, call me Tian from now on.",memory_update
"hey, what programming language did I say I prefer?",memory_retrieval
Do you know my nickname?,memory_retrieval
Remember to come back to the workshop.,memory_update
"yo, what did you save about my favorite app?",memory_retrieval
Please remember that the robot manual is near the charging station.,memory_update
Can you help me brainstorm a project about calculus?,chat
Remember that my favorite animal is a porcupine.,memory_update
Drive beside the desk.,movement
I usually want answers about algorithms to be step-by-step.,memory_update
"If a dog learned Python, what would it build?",chat
quick question: where is the robot manual?,memory_retrieval
My favorite color is lavender.,memory_update
Can you move left carefully?,movement
Save that the emergency exit is past the stairwell.,memory_update
quick question: return to the starting point.,movement
"okay, can you drive toward the exit in a straight line?",movement
"When you finish moving, return to the front office.",memory_update
Note that my favorite app is Twitch.,memory_update
quick question: can you recall the note about the notebook?,memory_retrieval
"yo, what is my favorite animal?",memory_retrieval
"The sketchbook is in the lab, keep that in memory.",memory_update
I moved my chair earlier and now I cannot find it.,chat
Where did I leave my water bottle?,memory_retrieval
Drive to the door.,movement
do you play games please?,chat
Can you compare Chess and Pokemon?,chat
Stop moving.,movement
"yo, can you recall the note about the water bottle?",memory_retrieval
Go to the front desk.,movement
hello!,chat
Do you like Google Docs or Snapchat better?,chat
Let's move on to another topic.,chat
Please remember that the laptop is near the charging station.,memory_update
quick question: where did I leave my USB drive?,memory_retrieval
Shift left without rushing.,movement
Shift right a couple steps.,movement
"yo, what's my favorite social platform?",memory_retrieval
quick question: can you recall the note about the ID card?,memory_retrieval
Walk with me to the front office.,movement
quick question: where did I leave my planner?,memory_retrieval
Save that my favorite game is Minecraft.,memory_update
Reverse without rushing.,movement
Move out of the walkway.,movement
"okay, walk with me to the front office.",movement
"yo, where did I leave my sketchbook?",memory_retrieval
I usually want answers about robotics to be beginner friendly.,memory_update
"If a dragonfly learned Python, what would it build?",chat
Remember that my favorite club topic is calculus.,memory_update
"The jacket is beside the whiteboard, keep that in memory.",memory_update
Tell me a tiny fun fact about music.,chat
"yo, where is the soccer ball?",memory_retrieval
"hey, where is the camera?",memory_retrieval
"yo, what does the word token mean?",chat
My favorite IDE is Atom.,memory_update
"hey BELT, can you walk backward smoothly?",movement
Have you ever heard of Valorant?,chat
Make a note that I use Cursor for coding.,memory_update
"Which is cooler, Notion or Instagram?",chat
What did you save about my explanation style?,memory_retrieval
Move closer.,movement
what is your favorite color please?,chat
"When you finish moving, return to the hallway.",memory_update
"yo, what did you save about my charger?",memory_retrieval
Do not forget that I like sandwiches after coding sessions.,memory_update
What is a good beginner project with scikit-learn?,chat
Save this detail: I like data science.,memory_update
Go to the previous room.,movement
What did I say my current project was?,memory_retrieval
Please go around without rushing.,movement
keep in mind that I am learning Minecraft lore.,memory_update
quick question: i moved my project folder earlier and now I cannot find it.,chat
Do you like Canva or YouTube better?,chat
I need to save my notebook before it crashes.,chat
"okay, can you recall the note about the ID card?",memory_retrieval
"Which is cooler, Discord or Instagram?",chat
My favorite IDE is Jupyter Notebook.,memory_update
Where did I leave my USB drive?,memory_retrieval
What did you save about my charger?,memory_retrieval
Make a note that I use Xcode for coding.,memory_update
Please remember that the laptop is by the door.,memory_update
Move around.,movement
Shift left at normal speed.,movement
Can you compare Minecraft and Stardew Valley?,chat
Do you like Twitch or Snapchat better?,chat
"From now on, if I ask about math, give me less jargon.",memory_update
"yo, where is the calculator?",memory_retrieval
Back up in a straight line.,movement
Move to the nearest emergency exit .,movement
Remember that my favorite club topic is game design.,memory_update
Drive around.,movement
"Which is cooler, Canva or Twitch?",chat
Remember to come back to the previous room.,memory_update
Can you move closer three small steps?,movement
Log this: my current project is about robot safety.,memory_update
Can you help me brainstorm a project about Minecraft lore?,chat
Store this preference: I like direct feedback.,memory_update
Shift left two steps.,movement
Can you help me write a sentence about soccer?,chat
Save that my favorite game is Brawl Stars.,memory_update
Can you make a silly sentence about a owl?,chat
Change my preferred editor to Replit.,memory_update
"yo, where is the laptop?",memory_retrieval
Does BELT have a favorite ice cream flavor?,chat
What is my favorite animal?,memory_retrieval
"okay, what object was I talking about earlier?",memory_retrieval
Can you move toward the exit in a straight line?,movement
Please remember that the phone charger is on the table.,memory_update
Where is the nearest emergency exit?,memory_retrieval
"I am bored, talk to me about music.",chat
Can you check out the hallway and come back?,movement
"okay, what saved details do you have for me?",memory_retrieval
"like, can you roll away from me slowly?",movement
"Yo, turn right.",movement
What preferences have you saved for me?,memory_retrieval
Can you move to the door one step?,movement
Scoot away three small steps.,movement
"I prefer being called Morgan, please remember.",memory_update
Can you help me brainstorm a project about game design?,chat
"yo, did I tell you my favorite IDE?",memory_retrieval
"The camera is under the chair, keep that in memory.",memory_update
What is the difference between a file and learning?,chat
"I am bored, talk to me about robots.",chat
quick question: how does a robot know where it is?,chat
good afternoon buddy,chat
Remember that my favorite club topic is PCA.,memory_update
Can you recall the note about the calculator?,memory_retrieval
"okay, what programming language did I say I prefer?",memory_retrieval
Can you make a silly sentence about a otter?,chat
What did I tell you about Brawl Stars?,memory_retrieval
I moved my dataset earlier and now I cannot find it.,chat
What is a good beginner project with computer vision?,chat
"okay, where did I leave my laptop?",memory_retrieval
Come closer at normal speed.,movement
Can you recall the note about the notebook?,memory_retrieval
"hey, show my saved memory.",memory_retrieval
Roll backward.,movement
Shift left a couple steps.,movement
What object was I talking about earlier?,memory_retrieval
Advance like two feet.,movement
Can you compare Among Us and Pokemon?,chat
"hey, which app did I say I liked most?",memory_retrieval
Scoot away carefully.,movement
Update my favorite social platform to YouTube.,memory_update
"yo, can you recall the note about the sketchbook?",memory_retrieval
Add to my notes that I play Valorant.,memory_update
"okay, can you recall the note about the notebook?",memory_retrieval
What does the word regularization mean?,chat
Do you like VSCode or Google Docs better?,chat
Can you move like one tile left?,movement
Do you know my favorite video game?,memory_retrieval
quick question: can you list my saved notes?,memory_retrieval
Can you compare Celeste and Geometry Dash?,chat
Please go away from me two steps.,movement
"The ID card is next to the couch, keep that in memory.",memory_update
"hey, what is my favorite color?",memory_retrieval
Face the whiteboard.,movement
quick question: where is the camera?,memory_retrieval
Can you make a silly sentence about a penguin?,chat
Can you compare Tetris and Roblox?,chat
Call me Tian from now on.,memory_update
Save this detail: I like Minecraft lore.,memory_update
"hey, what food did I tell you I like?",memory_retrieval
"yo, can you list my saved notes?",memory_retrieval
What do you think about homework?,chat
My favorite IDE is VSCode.,memory_update
"hey, who is your creator?",memory_retrieval
Can you make a silly sentence about a wolf?,chat
"like, rotate counterclockwise carefully.",movement
Remember my nickname is T.,memory_update
quick question: that movie was actually pretty good.,chat
Which direction did I say the exit was?,memory_retrieval
"The phone charger is in the lab, keep that in memory.",memory_update
Move forward.,movement
"Hey, I play Brawl Stars, remember that.",memory_update
Can you make a silly sentence about a porcupine?,chat
"yo, where did I leave my notebook?",memory_retrieval
Can you recall the note about the laptop?,memory_retrieval
"yo, what did I ask you to remember?",memory_retrieval
Drive closer.,movement
"hey, advance a little bit.",movement
Save that my favorite game is Mario Kart.,memory_update
Keep in mind that I am learning machine learning.,memory_update
Line yourself up with the door.,movement
Go away from me.,movement
My favorite IDE is Sublime Text.,memory_update
Change my preferred editor to Cursor.,memory_update
can you explain computer vision like I am new to it?,chat
"robot buddy, face a little right please.",movement
"yo, do you know whether I like examples?",memory_retrieval
"yo, where is the nearest emergency exit?",memory_retrieval
Line yourself up with the whiteboard.,movement
Save this detail: I like calculus.,memory_update
"When you finish moving, return to the computer lab.",memory_update
Roll left.,movement
Shift forward three small steps.,movement
Remember my nickname is Lux.,memory_update
"My favorite food is burritos, remember that.",memory_update
"okay, what's my name again?",memory_retrieval
good evening BELT,chat
Tell me a tiny fun fact about AI.,chat
Move left.,movement
Please go beside the desk gently.,movement
Shift right like two feet.,movement
Line yourself up with the wall.,movement
I need you to reposition near the table.,movement
"yo, face toward the whiteboard please.",movement
"hey, what did you save about my project?",memory_retrieval
What do you think about books?,chat
Rotate counterclockwise like two feet.,movement
hey bestie!,chat
Save that I left the jacket in the lab.,memory_update
Scoot away like two feet.,movement
"hey, turn so your front is facing the exit.",movement
good evening robot,chat
"Which is cooler, Notion or VSCode?",chat
Note that my favorite app is GitHub.,memory_update
"My favorite food is pizza, remember that.",memory_update
Do you like Pinterest or Snapchat better?,chat
Log this: my current project is about computer vision.,memory_update
"yo, which app did I say I liked most?",memory_retrieval
BELT should remember that Luna likes Tetris.,memory_update
"yo, log this: my current project is about voice interaction.",memory_update
"okay, can you recall the note about the USB drive?",memory_retrieval
Line yourself up with the hallway.,movement
BELT should remember that Riley likes Roblox.,memory_update
"hey, tell me what you know about my preferences.",memory_retrieval
Rotate ninety degrees right carefully.,movement
Can you help me brainstorm a project about Python?,chat
Can you check out the doorway and come back?,movement
"um, rotate a little left carefully.",movement
BELT should remember that Avery likes Minecraft.,memory_update
Tell me a tiny fun fact about weather.,chat
Update my favorite social platform to GitHub.,memory_update
quick question: where is the planner?,memory_retrieval
What is the difference between memory and a model?,chat
Please go farther three small steps.,movement
What is your favorite app?,chat
"okay, can you help me brainstorm a project about data science?",chat
Rotate ninety degrees left for a few seconds.,movement
Do not forget that I like pho after coding sessions.,memory_update
hello!!,chat
Do you like Duolingo or YouTube better?,chat
Save that I left the headphones on the table.,memory_update
Rotate ninety degrees left three small steps.,movement
Change my preferred editor to IntelliJ.,memory_update
"I prefer being called Sam, please remember.",memory_update
"hey, where is the nearest emergency exit?",memory_retrieval
"yo, store this preference: I like direct feedback.",memory_update
"When you finish moving, return to the stairwell.",memory_update
Where did I leave my sketchbook?,memory_retrieval
quick question: what room are we supposed to return to?,memory_retrieval
"like, rotate toward the hallway real quick.",movement
Roll to the door.,movement
Move to the previous room.,movement
"yo, what programming language did I say I prefer?",memory_retrieval
Face the previous room.,movement
"okay, which app did I say I liked most?",memory_retrieval
Can you help me write a sentence about machine learning?,chat
Shift forward at normal speed.,movement
do you know any fun facts real quick?,chat
What did I tell you about VSCode?,memory_retrieval
Save this detail: I like AI safety.,memory_update
