text,intent
actually just can you introduce yourself rn,chat
Are you a chatbot?,chat
Can you remember that I am building BELT?,memory_update
"hey BELT, lead me to the cafeteria.",navigation
Keep in mind that I want you to use fewer emojis.,memory_update
What is TF-IDF?,knowledge_lookup
The movement in that song is cool.,chat
Show me the way to the parking lot.,navigation
Give me a quick definition of pandas read_csv.,knowledge_lookup
"okay, walk to my right about a foot carefully please",movement
"when it's safe, how do I get to the emergency exit?",navigation
"robot, what is your favorite animal lol",chat
I need facts about tokenization.,knowledge_lookup
What's the difference between computer memory and something similar?,knowledge_lookup
hey just what is your robot name real quick,chat
"robot, walk back slightly",movement
"buddy, roll toward me three steps",movement
wait could you make this sentence clearer thanks,chat
"For future chats, remember that I want you to call me chief.",memory_update
hmm Can you help with coding real quick,chat
Store this: I want concise code comments.,memory_update
Can you look up information about pandas read_csv?,knowledge_lookup
Who exactly are you?,chat
actually just remember the concept from earlier real quick,chat
Are you like a campus assistant?,chat
"when it's safe, go check out the office.",navigation
can you face left just a tiny bit when you can,movement
What's the difference between pandas read_csv and something similar?,knowledge_lookup
Which way should I go to reach the bus stop?,navigation
face to my left two steps carefully please,movement
"bro I mean, explain that differently rn",chat
"hey, add this to my memory: I am your creator.",memory_update
Back up a little.,movement
drive backward slightly please,movement
"I mean, can you help me plan my project if you can",chat
What are common causes of low classifier confidence?,knowledge_lookup
um What is your favorite color if you can,chat
"okay, shift to my right two steps for a second",movement
"BELT, ask me something interesting if you can",chat
hey Move on to the next idea rn,chat
bro Can you make this less awkward for a second,chat
Go to the classroom and wait there.,navigation
"Hello, are you online?",chat
Can you find a route to the bus stop?,navigation
That was funny.,chat
I need you to turn to my right a bit,movement
"when it's safe, navigate to the library.",navigation
um Remember the concept from earlier if you can,chat
walk to my left slightly for a second,movement
What is the C parameter?,knowledge_lookup
hey could you tell me a joke?,chat
"hey, why is path planning useful?",knowledge_lookup
"For future chats, remember that my laptop is on the desk.",memory_update
move to my right carefully,movement
quick question: what does TF-IDF mean?,knowledge_lookup
hmm What are you for a second,chat
Can you teach me about precision and recall?,knowledge_lookup
Take me to the cafeteria.,navigation
can you shift to my right two steps,movement
bro just can you make this less awkward thanks,chat
Show me the way to the front desk.,navigation
"robot, can you help with coding for a second",chat
Can you look up information about computer memory?,knowledge_lookup
"hey BELT, take me to the office.",navigation
"hey, tell me the basics of macro F1.",knowledge_lookup
yo Save the model file lol,chat
"when it's safe, show me the way to the gym.",navigation
hey could you ask me something interesting!!,chat
quick memory update: store this: I like mint chocolate chip ice cream.,memory_update
Guide me back to this room later.,navigation
um navigate to the office.,navigation
yo how do I get to the robotics lab?,navigation
could you ask me something interesting for a second,chat
yo i need directions to the emergency exit.,navigation
What is your favorite ice cream flavor?,chat
"also, store this: I put my notebook in my backpack.",memory_update
"when it's safe, help me get to the office.",navigation
"hey, give me a quick definition of a lidar sensor.",knowledge_lookup
bro just how are you rn,chat
Keep in mind that I am your creator.,memory_update
Go check out the library.,navigation
I need directions to the maker space.,navigation
Lead me to the parking lot.,navigation
"buddy, scoot forward two steps",movement
Bring me to the maker space.,navigation
Why is the nearest emergency exit useful?,knowledge_lookup
hey what is your favorite color rn,chat
"um, shift back just a tiny bit please",movement
"for my project, why is an SVM useful?",knowledge_lookup
please go to my right a bit,movement
"Yo BELT, what's up?",chat
"BELT, did you know I play Brawl Stars? Remember that.",memory_update
"BELT, make this sound less awkward!!",chat
Rotate clockwise.,movement
move right slightly when you can,movement
"hey I mean, can you help with coding rn",chat
I need you to face away from me slightly,movement
yo just what can you do?,chat
yo help me get to the classroom.,navigation
bro can you make this less awkward,chat
Are you real or virtual?,chat
please walk to my right about a foot,movement
"hmm I mean, save the model file please",chat
um the movement was smooth real quick,chat
"yo, walk backward just a tiny bit for a second",movement
"hey BELT, take me to the bus stop.",navigation
"BELT, make this sound less awkward real quick",chat
"robot, turn counterclockwise slightly",movement
Which way should I go to reach the previous room?,navigation
hmm just can you explain vectorization lol,chat
Lead me to the next room.,navigation
please shift backward two steps,movement
Ask me a fun question.,chat
move left a couple steps when you can,movement
"hey, store this: I am your creator.",memory_update
"okay, move clockwise slowly",movement
Can you remember that my laptop is on the desk?,memory_update
um Can you help me plan my project if you can,chat
How does the definition of motivation work?,knowledge_lookup
"um, face backward slightly please",movement
hmm could you rewrite this so it sounds nicer!!,chat
"when it's safe, take me to the nearest exit.",navigation
yo navigate to the cafeteria.,navigation
Note that I like examples with robots.,memory_update
please roll toward me a bit,movement
Note that I am studying logistic regression.,memory_update
"BELT, walk away from me a little",movement
Add this to my memory: I learn better from step by step explanations.,memory_update
What time does the library close?,knowledge_lookup
bro just are you a robot for a second,chat
hmm can you help with coding thanks,chat
bro can we chat for a bit,chat
"I mean, can you give me a quick pep talk please",chat
Give me a quick definition of computer memory.,knowledge_lookup
Can you teach me about n-grams?,knowledge_lookup
Can you escort me to the bathroom?,navigation
Can you explain scikit-learn pipelines?,knowledge_lookup
I need facts about pandas read_csv.,knowledge_lookup
please scoot away from me two steps,movement
"okay I mean, can you talk real quick",chat
scoot left just a tiny bit slowly please,movement
"BELT, drive backward three steps",movement
hmm can you make this less awkward thanks,chat
Tell me the basics of wheel odometry.,knowledge_lookup
can you introduce yourself for a second,chat
actually could you make this sentence clearer?,chat
Can you explain macro F1?,knowledge_lookup
How do I get to the parking lot?,navigation
Go check out the previous room.,navigation
can you drive farther away about a foot real quick,movement
"for my project, give me a quick definition of scikit-learn pipelines.",knowledge_lookup
"okay, scoot forward just a tiny bit for a second",movement
Roll backward slowly.,movement
"okay I mean, I'm bored, talk to me thanks",chat
"BELT, scoot to my left slowly",movement
"I mean, make this sentence clearer please",chat
yo just can you give me a quick pep talk,chat
hey could you make this sentence clearer lol,chat
"uh I mean, move on to the next idea for a second",chat
How do I get to the gym?,navigation
wait just can we chat for a bit if you can,chat
Give me a random fun fact.,chat
can you rotate forward one step,movement
um could you tell me about yourself?,chat
"uh I mean, remember the concept from earlier thanks",chat
"robot, Who are you?",chat
"for my project, i need facts about a vectorizer.",knowledge_lookup
Can you teach me about wheel odometry?,knowledge_lookup
Did you know my favorite color is blue? Remember that.,memory_update
"um, roll right two steps slowly please",movement
What can you do?,chat
Help me get to the parking lot.,navigation
Can you teach me about cross validation?,knowledge_lookup
Take me to the office.,navigation
Can you guide me to the lab room?,navigation
roll back slowly if it's safe,movement
please go backward a little,movement
yo can you escort me to the bathroom?,navigation
"um, shift to my right a bit",movement
Take me to the quiet study area.,navigation
"hey, turn to my right carefully slowly please",movement
can you face toward me a bit carefully please,movement
Drive forward carefully.,movement
Did you know I want concise code comments? Remember that.,memory_update
Tell me about yourself.,chat
Go to the next room and wait there.,navigation
What is the difference between SVM and logistic regression?,chat
uh save the model file lol,chat
Help me get to the library.,navigation
Store this: my favorite game is Minecraft.,memory_update
Which way should I go to reach the nearest exit?,navigation
Move to the nearest emergency exit.,navigation
yo how do I get to the classroom?,navigation
"BELT, go to my left slightly",movement
How does logistic regression work?,knowledge_lookup
please walk farther away just a tiny bit,movement
I need you to back up toward me two steps,movement
How does the difference between chat and knowledge lookup work?,knowledge_lookup
please turn to my left a little,movement
"yo I'm bored, talk to me?",chat
please roll clockwise a couple steps,movement
That makes sense?,chat
Add this to my memory: I want concise code comments.,memory_update
"actually I mean, what is your favorite animal please",chat
hey what does memory mean real quick,chat
scoot counterclockwise one step carefully please,movement
turn to my left carefully for a second,movement
shift farther away just a tiny bit if it's safe,movement
please turn clockwise a little,movement
yo What is your favorite animal thanks,chat
"yo I mean, how are you!!",chat
"robot, shift backward a couple steps",movement
um i need directions to the elevator.,navigation
"BELT, can you teach me about obstacle avoidance?",knowledge_lookup
Can you explain KNN?,knowledge_lookup
wait just what is your robot name rn,chat
um just ask me something interesting?,chat
"okay, turn counterclockwise just a tiny bit slowly please",movement
go back slowly if it's safe,movement
What does micro F1 mean?,knowledge_lookup
What is a vectorizer?,knowledge_lookup
Can you look up information about n-grams?,knowledge_lookup
hmm are you a robot,chat
"okay, roll back slightly if it's safe",movement
Point me toward the office.,navigation
Save this about me: I put my notebook in my backpack.,memory_update
please walk to my left about a foot,movement
shift left slowly if it's safe,movement
actually Give me motivation thanks,chat
wait just can you make this less awkward please,chat
"hey BELT, i need directions to the previous room.",navigation
Can you escort me to the next room?,navigation
um are you a robot lol,chat
"when it's safe, i need directions to the main entrance.",navigation
Navigate to the library.,navigation
Please remember that I prefer YouTube over TikTok.,memory_update
um that makes sense please,chat
"uh I mean, that makes sense real quick",chat
quick question: why is Python joblib useful?,knowledge_lookup
wait just what is your purpose if you can,chat
Should I add more training data?,chat
okay just that movie was awesome real quick,chat
I need you to face counterclockwise about a foot,movement
um explain that differently rn,chat
"for my project, can you teach me about pandas read_csv?",knowledge_lookup
"BELT, Make this sound less awkward for a second",chat
um what is your favorite color rn,chat
"hey, roll toward me slightly please",movement
"Just so you know, I like coding late at night.",memory_update
"also, from now on, know that I put my notebook in my backpack.",memory_update
just make this sound less awkward!!,chat
Go check out the computer science building.,navigation
hmm Can you help with coding rn,chat
Tell me the basics of scikit-learn pipelines.,knowledge_lookup
could you remember the concept from earlier please,chat
I need you to face to my right slowly,movement
okay can we chat for a bit thanks,chat
uh Can you help me plan my project for a second,chat
"actually I mean, explain that differently for a second",chat
"yo, shift away from me slightly carefully please",movement
please shift forward one step,movement
Show me the way to the elevator.,navigation
wait save the model file please,chat
I need you to back up back two steps,movement
um just that was funny!!,chat
actually what can you do thanks,chat
I need you to back up farther away carefully,movement
"hey BELT, navigate to the computer science building.",navigation
hey What is your purpose if you can,chat
Can you teach me about the C parameter?,knowledge_lookup
can you turn clockwise slightly slowly please,movement
Save that my favorite platform is Instagram.,memory_update
can you rotate back a bit,movement
I need directions to room 101.,navigation
"when it's safe, point me toward the bathroom.",navigation
please go closer slightly,movement
please drive farther away two steps,movement
"BELT, What are you!!",chat
Can you look up information about precision and recall?,knowledge_lookup
hmm just can you explain vectorization,chat
Note that I want you to use fewer emojis.,memory_update
Can you give me a quick pep talk please,chat
"when it's safe, can you guide me to the office?",navigation
Go check out the stairs.,navigation
bro What is your favorite animal thanks,chat
"buddy, roll left a bit",movement
How does tokenization work?,knowledge_lookup
can you drive backward about a foot please,movement
Can you explain cross validation?,knowledge_lookup
can you face closer about a foot,movement
Walk away from me.,movement
um can we chat for a bit?,chat
I need you to scoot right a couple steps,movement
"hey I mean, how are you lol",chat
Show me the way to the emergency exit.,navigation
um help me get to the maker space.,navigation
yo Tell me a joke lol,chat
"yo, scoot backward about a foot carefully please",movement
I need you to go away from me a little,movement
"robot, face farther away one step",movement
"also, note that I want you to use fewer emojis.",memory_update
"robot, just make this sentence clearer",chat
yo bring me to the stairs.,navigation
I need you to face closer a little,movement
Please remember that I want you to use fewer emojis.,memory_update
I need facts about the C parameter.,knowledge_lookup
"BELT, shift to my right a couple steps",movement
please face counterclockwise a little,movement
Update my memory: I want shorter answers.,memory_update
actually are you a chatbot thanks,chat
"yo, back up backward a little carefully please",movement
Can you rewrite this politely?,chat
Can you be more concise?,chat
I want you to remember that my favorite IDE is VSCode.,memory_update
I need you to scoot clockwise carefully,movement
Can you help me think of ideas?,chat
Can you make this sound less awkward?,chat
Note that I prefer simple explanations.,memory_update
Can you take me back to the robotics lab?,navigation
Let's move on to the next topic.,chat
I need facts about SLAM.,knowledge_lookup
hmm can you help with coding please,chat
Can you find a route to the front desk?,navigation
"bro I mean, can you talk",chat
"hey BELT, lead me to the bathroom.",navigation
How does a decision boundary work?,knowledge_lookup
"when it's safe, bring me to the elevator.",navigation
Note that my favorite game is Minecraft.,memory_update
"hey, move back a little",movement
"robot, go closer about a foot",movement
"robot, just what is your robot name thanks",chat
"when it's safe, i need directions to room 101.",navigation
"hey I mean, explain that differently lol",chat
actually just can you help with coding thanks,chat
Keep in mind that I like robotics.,memory_update
"yo, back up clockwise a bit please",movement
I need you to roll closer just a tiny bit,movement
Help me get to the nearest exit.,navigation
I need you to move forward carefully,movement
I need facts about computer memory.,knowledge_lookup
yo just I moved houses last year!!,chat
"hey, rotate back about a foot slowly please",movement
"BELT, I mean, save the model file thanks",chat
hmm are you a robot rn,chat
"um I mean, can you talk lol",chat
walk to my left just a tiny bit if it's safe,movement
Navigate to the lab room.,navigation
Good afternoon BELT.,chat
Update my memory: I like detailed math explanations.,memory_update
What should I know about cross validation?,knowledge_lookup
Can you take me back to the emergency exit?,navigation
Can you guide me to the main entrance?,navigation
Walk me to the hallway.,navigation
Help me get to the hallway.,navigation
please walk clockwise about a foot,movement
wait Who are you real quick,chat
"I mean, make this sentence clearer for a second",chat
"BELT, give me a quick definition of a vectorizer.",knowledge_lookup
"By the way, I play Brawl Stars.",memory_update
"BELT, back up toward me a bit",movement
bro are you a robot!!,chat
Can you explain that again?,chat
"for my project, how does a vectorizer work?",knowledge_lookup
"BELT, can you teach me about class weights?",knowledge_lookup
can you walk left a bit when you can,movement
um can you escort me to the hallway?,navigation
um who are you if you can,chat
"wait I mean, can you explain vectorization if you can",chat
Do you remember this conversation?,chat
"okay, scoot to my right a little for a second",movement
Can you teach me about a decision boundary?,knowledge_lookup
Can you guide me to the robotics lab?,navigation
Can you explain weather today?,knowledge_lookup
"robot, just are you a robot",chat
"yo I mean, make this sentence clearer lol",chat
um What can you do rn,chat
I'm kind of bored right now.,chat
okay can you explain vectorization?,chat
wait could you the movement was smooth for a second,chat
face counterclockwise three steps when you can,movement
yo What is your favorite color!!,chat
"robot, what is your purpose thanks",chat
"robot, Can you talk for a second",chat
Can you escort me to the previous room?,navigation
Can you escort me to the parking lot?,navigation
bro how are you,chat
"robot, tell me a joke lol",chat
"um I mean, that movie was awesome?",chat
please shift counterclockwise a little,movement
"hey, from now on, know that I am learning machine learning.",memory_update
I need you to move to my left just a tiny bit,movement
"For future chats, remember that I want you to use fewer emojis.",memory_update
"wait I mean, give me motivation rn",chat
"um I mean, save the model file",chat
please back up backward two steps,movement
um bring me to the front desk.,navigation
can you move right just a tiny bit for a second,movement
please turn back about a foot,movement
Store this: I like robotics.,memory_update
"BELT, that movie was awesome",chat
Can you remember that I am working on a robot project?,memory_update
um i need directions to the bus stop.,navigation
okay just how are you please,chat
"Just so you know, I like mint chocolate chip ice cream.",memory_update
actually just ask me something interesting if you can,chat
"robot, shift away from me carefully",movement
"hey BELT, can you find a route to the previous room?",navigation
What can you do lol,chat
"robot, just rewrite this so it sounds nicer?",chat
"for my project, tell me the basics of the difference between chat and knowledge lookup.",knowledge_lookup
hmm can you give me a quick pep talk if you can,chat
Why is logistic regression useful?,knowledge_lookup
yo navigate to the main entrance.,navigation
"I mean, how are you thanks",chat
bro That makes sense if you can,chat
Tell me the basics of pandas read_csv.,knowledge_lookup
can you give me a quick pep talk!!,chat
"actually I mean, can you help me plan my project?",chat
"um, face left slowly when you can",movement
What should I know about a vectorizer?,knowledge_lookup
What is your favorite color for a second,chat
"robot, Rewrite this so it sounds nicer!!",chat
uh could you explain that differently!!,chat
hey could you make this sentence clearer?,chat
"when it's safe, bring me to the maker space.",navigation
Can you explain today's date?,knowledge_lookup
"robot, move clockwise a bit",movement
What does vectorizer mean?,chat
I want you to remember that I want concise code comments.,memory_update
"robot, face counterclockwise slightly",movement
"robot, move on to the next idea rn",chat
I need you to drive toward me carefully,movement
yo show me the way to the quiet study area.,navigation
can you walk counterclockwise a couple steps carefully please,movement
Can you look up information about KNN?,knowledge_lookup
can you face to my right a little for a second,movement
Walk me to the library.,navigation
"actually I mean, remember the concept from earlier lol",chat
shift to my right slowly please,movement
I want you to remember that my favorite game is Minecraft.,memory_update
What's the difference between the nearest emergency exit and something similar?,knowledge_lookup
Can you teach me about a confusion matrix?,knowledge_lookup
okay just can you help with coding thanks,chat
"yo I mean, help me brainstorm",chat
"robot, that was funny",chat
Can you help me brainstorm?,chat
I need you to back up closer a couple steps,movement
bro that was funny real quick,chat
actually just what can you do thanks,chat
hey what is your robot name,chat
Remember that I play Brawl Stars.,memory_update
"when it's safe, lead me to the robotics lab.",navigation
bro give me motivation lol,chat
hmm I moved houses last year thanks,chat
Walk me to the parking lot.,navigation
"BELT, face closer slightly",movement
"yo, drive right a bit if it's safe",movement
"hey BELT, show me the way to the stairs.",navigation
"um, drive farther away slowly slowly please",movement
hmm just make this sentence clearer,chat
What is regularization?,knowledge_lookup
Can you give me motivation?,chat
"BELT, I moved houses last year thanks",chat
"uh I mean, how are you if you can",chat
"hey BELT, how do I get to the computer science building?",navigation
"BELT, I mean, remember the concept from earlier if you can",chat
Help me get to the stairs.,navigation
"hey, i need facts about robot navigation.",knowledge_lookup
hey what can you do real quick,chat
yo Make this sound less awkward?,chat
uh remember the concept from earlier!!,chat
That makes sense for a second,chat
can you shift to my right a bit when you can,movement
"BELT, can you remember that I am learning machine learning?",memory_update
Go to the gym and wait there.,navigation
"robot, Are you a robot for a second",chat
"hmm I mean, what is your favorite animal thanks",chat
"robot, could you rewrite this so it sounds nicer lol",chat
uh just rewrite this so it sounds nicer real quick,chat
"okay I mean, can you introduce yourself",chat
can you back up toward me three steps real quick,movement
Keep in mind that I enjoy USACO.,memory_update
bro could you give me motivation!!,chat
How are you doing?,chat
"also, just so you know, I prefer friendly responses.",memory_update
bro could you the movement was smooth thanks,chat
move backward three steps if it's safe,movement
Lead me to the bathroom.,navigation
quick question: give me a quick definition of what brainstorm means.,knowledge_lookup
Save that I am working on a robot project.,memory_update
can you back up to my left a bit when you can,movement
"BELT, keep in mind that I am working on a robot project.",memory_update
"robot, move farther away about a foot",movement
"hey I mean, how are you if you can",chat
"BELT, give me a quick definition of wheel odometry.",knowledge_lookup
"hey, how does scikit-learn pipelines work?",knowledge_lookup
"wait I mean, that makes sense if you can",chat
yo that was funny lol,chat
yo can you escort me to the emergency exit?,navigation
"hey, what's the difference between obstacle avoidance and something similar?",knowledge_lookup
What is today's date?,knowledge_lookup
"robot, I mean, can you help me plan my project for a second",chat
"hmm I mean, can you talk!!",chat
okay Make this sentence clearer lol,chat
How do I get to the classroom?,navigation
"robot, back up farther away just a tiny bit",movement
yo how do I get to the bus stop?,navigation
What should I know about SLAM?,knowledge_lookup
"yo, drive counterclockwise a bit please",movement
How does what brainstorm means work?,knowledge_lookup
actually can you make this less awkward for a second,chat
"okay I mean, tell me a joke?",chat
"when it's safe, can you find a route to the lab room?",navigation
could you save the model file lol,chat
I need facts about precision and recall.,knowledge_lookup
"BELT, I mean, ask me something interesting?",chat
quick question: why is obstacle avoidance useful?,knowledge_lookup
roll counterclockwise about a foot real quick,movement
please rotate backward three steps,movement
please shift closer a couple steps,movement
um what is your favorite animal!!,chat
What should I call you?,chat
"hey BELT, can you take me back to the next room?",navigation
"BELT, store this: I like detailed math explanations.",memory_update
Can you wiggle in place?,movement
actually just what does memory mean!!,chat
Good evening BELT.,chat
Please remember that my favorite platform is Instagram.,memory_update
wait Can you talk?,chat
"robot, I mean, help me brainstorm?",chat
uh can you help me plan my project?,chat
What should I know about the nearest emergency exit?,knowledge_lookup
Point me toward the next room.,navigation
"hey, what is Python joblib?",knowledge_lookup
uh what can you do thanks,chat
