text,intent
"Just so you know, remember that I like when explanations use Minecraft.",memory_update
Put this in my memory: I like math.,memory_update
This is something to remember: I enjoy video games.,memory_update
This is something to remember: I enjoy Python.,memory_update
Save this: I am building something with video games.,memory_update
Memory update: I am learning math.,memory_update
Could you remember that my favorite game is coding?,memory_update
Save that my favorite color is black.,memory_update
"Just so you know, remember that I like beginner-friendly explanations.",memory_update
Could you remember that I use PyCharm for coding?,memory_update
Memory update: I put my robot controller in the lab.,memory_update
Make a note that I put my pencil case in the lab.,memory_update
Add this note about me: I love hackathons.,memory_update
Can you remember that I get confused by video games?,memory_update
You should remember that I use VSCode for coding.,memory_update
You should remember that I put my mouse in the lab.,memory_update
Don't forget that I use PyCharm for coding.,memory_update
"For next time, remember that I am practicing drawing.",memory_update
I want you to remember that I am working on a USACO project.,memory_update
Important memory: I prefer short explanations.,memory_update
"BELT, remember that my favorite game is puzzles.",memory_update
Remember that I enjoy video games.,memory_update
Could you remember that I like math?,memory_update
Memory update: I keep my sweater in my backpack.,memory_update
I want you to remember that I play robotics.,memory_update
This is something to remember: I keep my umbrella in my backpack.,memory_update
Save this: I am practicing robots.,memory_update
I would like you to remember that I am building something with writing.,memory_update
Please remember this about me: I like beginner-friendly explanations.,memory_update
Note that I play puzzles.,memory_update
"BELT, note that I get confused by math.",memory_update
Remember that I love math.,memory_update
Please save this detail: I want to improve at Brawl Stars.,memory_update
Can you keep track of this: my favorite food is mango?,memory_update
Add to my memory that I play Python.,memory_update
Could you remember that I keep my tablet in my backpack?,memory_update
Save this: my favorite game is coding.,memory_update
Put this in my memory: I am interested in writing.,memory_update
I want you to remember that I like puzzles.,memory_update
I would like you to remember that I put my water bottle in the lab.,memory_update
I want you to remember that I like when explanations use robots.,memory_update
Put this in my memory: I like when explanations use robots.,memory_update
Can you remember that I enjoy USAAIO?,memory_update
Can you remember that I like beginner-friendly explanations?,memory_update
Save this: I am working on a Brawl Stars project.,memory_update
Please remember this about me: I am interested in science.,memory_update
This is something to remember: I am building something with puzzles.,memory_update
Put this in my memory: I keep my water bottle in my backpack.,memory_update
Put this in my memory: I keep my sweater in my backpack.,memory_update
This is something to remember: I put my jacket in the lab.,memory_update
Keep in mind that I am interested in history.,memory_update
Memory update: I like AI.,memory_update
I want you to remember that I care about fantasy stories.,memory_update
Save this: I usually code in Java.,memory_update
Please remember this about me: I prefer detailed explanations.,memory_update
Add to my memory that I like puzzles.,memory_update
You should remember that I am learning video games.,memory_update
Save that I am practicing Java.,memory_update
"BELT, remember that I prefer short explanations.",memory_update
Can you keep track of this: I am building something with USACO?,memory_update
"For next time, remember that I like when explanations use fantasy stories.",memory_update
I would like you to remember that I like when explanations use neural networks.,memory_update
Add to my memory that I like when explanations use neural networks.,memory_update
I want you to remember that I am interested in writing.,memory_update
Please save this detail: I play puzzles.,memory_update
"BELT, remember that my favorite food is mango.",memory_update
Can you save that I use VSCode for coding?,memory_update
Please remember this about me: I want help with music.,memory_update
Can you save that I care about fantasy stories?,memory_update
Important memory: I like puzzles.,memory_update
Save that I want help with machine learning.,memory_update
Can you save that I want to improve at campus robots?,memory_update
Keep in mind that I keep my sweater in my backpack.,memory_update
Note that my favorite color is turquoise.,memory_update
Memory update: I am interested in history.,memory_update
Note that I prefer examples about hackathons.,memory_update
Add this note about me: I usually code in Python.,memory_update
This is something to remember: I use VSCode for coding.,memory_update
"Just so you know, remember that I play game design.",memory_update
This is something to remember: I prefer detailed explanations.,memory_update
Make a note that my current project is about neural networks.,memory_update
Please save this detail: I like when explanations use Java.,memory_update
Save this: I like Brawl Stars.,memory_update
I would like you to remember that I like beginner-friendly explanations.,memory_update
"For next time, remember that I am working on a coding project.",memory_update
Can you remember that I prefer short explanations?,memory_update
Can you remember that I am learning drawing?,memory_update
Don't forget that I want to improve at coding.,memory_update
"Just so you know, remember that I am building something with AI.",memory_update
"Just so you know, remember that I love Minecraft.",memory_update
Please don't forget this about me: I love science.,memory_update
Store this about me: I prefer detailed explanations.,memory_update
Don't forget that I get confused by music.,memory_update
I want you to remember that I care about YouTube.,memory_update
Store this about me: my favorite color is lavender.,memory_update
Save that I play music.,memory_update
I want you to remember that my current project is about USAAIO.,memory_update
This is something to remember: I am practicing video games.,memory_update
Save this: I want to improve at robots.,memory_update
I would like you to remember that my favorite game is Minecraft.,memory_update
Important memory: I put my USB cable in the lab.,memory_update
"For next time, remember that my favorite food is pizza.",memory_update
Save that I get confused by game design.,memory_update
Store this about me: I am interested in data science.,memory_update
Store this about me: I like when explanations use Java.,memory_update
You should remember that I prefer examples about puzzles.,memory_update
Could you remember that my current project is about YouTube?,memory_update
Save this: my favorite color is black.,memory_update
Please save this detail: my favorite color is lavender.,memory_update
Keep in mind that I like when explanations use robots.,memory_update
Can you remember that I like when explanations use neural networks?,memory_update
Don't forget that I keep my water bottle in my backpack.,memory_update
Please remember this about me: I use VSCode for coding.,memory_update
"BELT, note that my favorite color is turquoise.",memory_update
Memory update: my favorite color is lavender.,memory_update
Remember that I like when explanations use Minecraft.,memory_update
Keep in mind that I love history.,memory_update
Please don't forget this about me: I prefer short explanations.,memory_update
"BELT, remember that I am building something with video games.",memory_update
Add this note about me: I like beginner-friendly explanations.,memory_update
Save this: I care about robots.,memory_update
Please don't forget this about me: I am practicing writing.,memory_update
Please note that I am interested in writing.,memory_update
Can you keep track of this: I like when explanations use neural networks?,memory_update
"BELT, note that I usually code in Java.",memory_update
Note that I usually code in Python.,memory_update
Could you remember that I am interested in science?,memory_update
Keep in mind that I care about linear algebra.,memory_update
Can you save that I want to improve at music?,memory_update
Can you keep track of this: I enjoy music?,memory_update
"Just so you know, remember that I prefer examples about coding.",memory_update
I want you to remember that I like when explanations use campus robots.,memory_update
This is something to remember: I like coding.,memory_update
Can you save that I use PyCharm for coding?,memory_update
Can you save that I want to improve at math?,memory_update
Save that I prefer examples about YouTube.,memory_update
Please don't forget this about me: my favorite game is coding.,memory_update
"For next time, remember that my favorite color is purple.",memory_update
Don't forget that I prefer examples about math.,memory_update
Please remember that I am building something with video games.,memory_update
"For next time, remember that I am building something with AI.",memory_update
Memory update: I like beginner-friendly explanations.,memory_update
Keep in mind that I use VSCode for coding.,memory_update
Keep in mind that I prefer detailed explanations.,memory_update
Put this in my memory: I play PCA.,memory_update
Put this in my memory: my favorite color is turquoise.,memory_update
You should remember that I like beginner-friendly explanations.,memory_update
Keep in mind that I keep my tablet in my backpack.,memory_update
Store this about me: I care about websites.,memory_update
Add to my memory that I play puzzles.,memory_update
Don't forget that I usually code in Python.,memory_update
Put this in my memory: my current project is about Brawl Stars.,memory_update
Make a note that I care about PCA.,memory_update
Store this about me: I usually code in Java.,memory_update
Add this note about me: I play game design.,memory_update
Put this in my memory: I want help with video games.,memory_update
Can you remember that I am building something with AI?,memory_update
Save that I am building something with AI.,memory_update
I want you to remember that I like coding.,memory_update
Save that I use VSCode for coding.,memory_update
"BELT, remember that I prefer detailed explanations.",memory_update
"BELT, remember that I love Minecraft.",memory_update
Add to my memory that I am practicing robots.,memory_update
"Just so you know, remember that I like when explanations use fantasy stories.",memory_update
I would like you to remember that my favorite food is pancakes.,memory_update
Could you remember that I like linear algebra?,memory_update
"BELT, remember that my current project is about AI.",memory_update
Important memory: I put my camera in the lab.,memory_update
"BELT, remember that I enjoy video games.",memory_update
You should remember that I love Minecraft.,memory_update
Note that I am learning robotics.,memory_update
"BELT, note that my current project is about neural networks.",memory_update
Could you remember that I am building something with video games?,memory_update
Save this: I like when explanations use robots.,memory_update
Important memory: I prefer detailed explanations.,memory_update
Don't forget that I am interested in history.,memory_update
Put this in my memory: I am building something with Python.,memory_update
Please remember this about me: I am interested in history.,memory_update
Can you keep track of this: I usually code in Python?,memory_update
Please remember this about me: I use PyCharm for coding.,memory_update
Can you remember that I am practicing Minecraft?,memory_update
Add to my memory that I get confused by campus robots.,memory_update
Please save this detail: I want to improve at coding.,memory_update
Please save this detail: I am practicing writing.,memory_update
Add to my memory that I play drawing.,memory_update
I want you to remember that I am working on a history project.,memory_update
Memory update: I am working on a fantasy stories project.,memory_update
Please remember this about me: I care about websites.,memory_update
I want you to remember that I am learning animation.,memory_update
Memory update: I am practicing puzzles.,memory_update
Remember that I am learning drawing.,memory_update
Please note that I get confused by machine learning.,memory_update
Could you remember that I am building something with AI?,memory_update
Can you save that I get confused by computer vision?,memory_update
"For next time, remember that I love fantasy stories.",memory_update
"Just so you know, remember that I usually code in Python.",memory_update
I want you to remember that I am interested in data science.,memory_update
"BELT, note that I use PyCharm for coding.",memory_update
Put this in my memory: I love Minecraft.,memory_update
Please remember this about me: I want help with machine learning.,memory_update
Save that I am interested in history.,memory_update
"For next time, remember that I usually code in Java.",memory_update
Memory update: I usually code in Python.,memory_update
"BELT, note that my current project is about Brawl Stars.",memory_update
Don't forget that I like beginner-friendly explanations.,memory_update
Note that my favorite color is lavender.,memory_update
Put this in my memory: I am interested in data science.,memory_update
Make a note that I play game design.,memory_update
Add this note about me: I care about animation.,memory_update
Important memory: I love websites.,memory_update
This is something to remember: my favorite game is soccer.,memory_update
I would like you to remember that I prefer detailed explanations.,memory_update
This is something to remember: I am practicing linear algebra.,memory_update
Please don't forget this about me: I enjoy music.,memory_update
Make a note that I am practicing music.,memory_update
Remember that I love history.,memory_update
Memory update: I like when explanations use neural networks.,memory_update
Make a note that I like linear algebra.,memory_update
This is something to remember: I am interested in soccer.,memory_update
Don't forget that I love fantasy stories.,memory_update
"For next time, remember that my current project is about robots.",memory_update
You should remember that I get confused by game design.,memory_update
"Just so you know, remember that I get confused by history.",memory_update
"Just so you know, remember that I love science.",memory_update
Please remember that my favorite game is coding.,memory_update
"Just so you know, remember that I prefer detailed explanations.",memory_update
Add this note about me: I am working on a puzzles project.,memory_update
Save this: my favorite game is robotics.,memory_update
Memory update: I want help with USACO.,memory_update
Remember that I usually code in Java.,memory_update
Add this note about me: my favorite color is purple.,memory_update
Please don't forget this about me: I want help with machine learning.,memory_update
Important memory: I use VSCode for coding.,memory_update
Don't forget that I enjoy robots.,memory_update
I would like you to remember that I usually code in Java.,memory_update
I would like you to remember that I prefer short explanations.,memory_update
Put this in my memory: I want to improve at fantasy stories.,memory_update
Can you save that I get confused by data science?,memory_update
This is something to remember: my favorite game is websites.,memory_update
Can you keep track of this: I prefer examples about USACO?,memory_update
Please save this detail: I am learning drawing.,memory_update
Can you keep track of this: I keep my water bottle in my backpack?,memory_update
Add to my memory that I am building something with AI.,memory_update
"For next time, remember that I prefer short explanations.",memory_update
Remember that my favorite game is websites.,memory_update
I want you to remember that my favorite game is USAAIO.,memory_update
Add to my memory that I prefer detailed explanations.,memory_update
Add this note about me: I prefer examples about PCA.,memory_update
Can you keep track of this: I put my mouse in the lab?,memory_update
Please remember that I get confused by drawing.,memory_update
"For next time, remember that I play Brawl Stars.",memory_update
Remember that I am working on a PCA project.,memory_update
Can you remember that I am practicing puzzles?,memory_update
"For next time, remember that I play puzzles.",memory_update
Important memory: my current project is about AI.,memory_update
Add this note about me: I use PyCharm for coding.,memory_update
Could you remember that I prefer detailed explanations?,memory_update
Important memory: I get confused by campus robots.,memory_update
You should remember that my favorite color is green.,memory_update
Important memory: I want to improve at animation.,memory_update
You should remember that I put my jacket in the lab.,memory_update
"For next time, remember that I want to improve at animation.",memory_update
Please note that I play linear algebra.,memory_update
Save that I care about puzzles.,memory_update
Keep in mind that I get confused by AI.,memory_update
Put this in my memory: I prefer detailed explanations.,memory_update
Add to my memory that I usually code in Java.,memory_update
Can you remember that I like when explanations use campus robots?,memory_update
Can you keep track of this: I enjoy hackathons?,memory_update
I would like you to remember that I enjoy USAAIO.,memory_update
Add this note about me: I like when explanations use campus robots.,memory_update
Could you remember that I am learning fantasy stories?,memory_update
Can you keep track of this: I keep my sweater in my backpack?,memory_update
Save this: I keep my planner in my backpack.,memory_update
Add this note about me: my current project is about Minecraft.,memory_update
Don't forget that I am building something with USACO.,memory_update
I would like you to remember that I want to improve at Brawl Stars.,memory_update
Please note that I am practicing music.,memory_update
Could you remember that I want to improve at fantasy stories?,memory_update
Memory update: my current project is about computer vision.,memory_update
Remember that I enjoy neural networks.,memory_update
Can you remember that I usually code in Python?,memory_update
Memory update: I enjoy music.,memory_update
"For next time, remember that I use VSCode for coding.",memory_update
This is something to remember: my favorite game is Minecraft.,memory_update
Put this in my memory: I usually code in Java.,memory_update
"Just so you know, remember that my favorite game is robotics.",memory_update
Can you save that I want help with video games?,memory_update
Remember that I put my water bottle in the lab.,memory_update
I would like you to remember that I am practicing soccer.,memory_update
Add this note about me: my favorite color is turquoise.,memory_update
Could you remember that I usually code in Java?,memory_update
Please remember that I keep my notebook in my backpack.,memory_update
Could you remember that I want help with USACO?,memory_update
Please remember this about me: I usually code in Java.,memory_update
Add to my memory that I keep my umbrella in my backpack.,memory_update
Can you remember that my favorite color is lavender?,memory_update
Please remember that I get confused by music.,memory_update
"Just so you know, remember that I like Brawl Stars.",memory_update
Could you remember that I am building something with neural networks?,memory_update
Note that my favorite food is pizza.,memory_update
"Just so you know, remember that I keep my jacket in my backpack.",memory_update
Please remember this about me: I like when explanations use Minecraft.,memory_update
Important memory: I want to improve at coding.,memory_update
Please note that I keep my water bottle in my backpack.,memory_update
Save that I like Brawl Stars.,memory_update
Save that my favorite color is turquoise.,memory_update
Don't forget that I am practicing puzzles.,memory_update
"For next time, remember that I am working on a Python project.",memory_update
Please remember this about me: I like when explanations use neural networks.,memory_update
Keep in mind that my favorite color is black.,memory_update
"BELT, remember that I like AI.",memory_update
I would like you to remember that I want help with Brawl Stars.,memory_update
Keep in mind that I like AI.,memory_update
Please remember that I prefer examples about math.,memory_update
Make a note that I am learning fantasy stories.,memory_update
Note that I prefer examples about PCA.,memory_update
You should remember that I play game design.,memory_update
Store this about me: I care about robots.,memory_update
Remember that I keep my tablet in my backpack.,memory_update
Could you remember that I am learning robots?,memory_update
"BELT, note that I love fantasy stories.",memory_update
This is something to remember: I love video games.,memory_update
Save that I usually code in Java.,memory_update
Important memory: I am building something with Minecraft.,memory_update
Please save this detail: I am building something with coding.,memory_update
Make a note that I am interested in science.,memory_update
Please note that I love history.,memory_update
Add this note about me: I keep my calculator in my backpack.,memory_update
Could you remember that I put my mouse in the lab?,memory_update
Please remember this about me: I put my headphones in the lab.,memory_update
I would like you to remember that I keep my notebook in my backpack.,memory_update
Please don't forget this about me: I am interested in history.,memory_update
Can you keep track of this: I prefer short explanations?,memory_update
Add this note about me: I enjoy computer vision.,memory_update
"For next time, remember that I like when explanations use Java.",memory_update
I want you to remember that I keep my pencil case in my backpack.,memory_update
Please save this detail: I want to improve at robots.,memory_update
"BELT, remember that I am working on a robotics project.",memory_update
Can you keep track of this: I am working on a Brawl Stars project?,memory_update
"Just so you know, remember that I prefer examples about websites.",memory_update
Save this: my favorite game is puzzles.,memory_update
Remember that I prefer examples about puzzles.,memory_update
Could you remember that I keep my umbrella in my backpack?,memory_update
Can you remember that I care about animation?,memory_update
You should remember that I want to improve at campus robots.,memory_update
"BELT, remember that I want to improve at coding.",memory_update
Can you save that I prefer detailed explanations?,memory_update
Memory update: I am practicing linear algebra.,memory_update
This is something to remember: I like robotics.,memory_update
Could you remember that I prefer examples about YouTube?,memory_update
Make a note that I enjoy Python.,memory_update
Save that I like when explanations use Minecraft.,memory_update
Put this in my memory: I am practicing Minecraft.,memory_update
Save this: I like science.,memory_update
Could you remember that my favorite game is puzzles?,memory_update
"BELT, remember that I like when explanations use campus robots.",memory_update
"BELT, remember that I want to improve at PCA.",memory_update
Can you keep track of this: I put my jacket in the lab?,memory_update
Important memory: my current project is about YouTube.,memory_update
"BELT, note that I am practicing robots.",memory_update
"For next time, remember that I get confused by video games.",memory_update
Please remember this about me: my current project is about computer vision.,memory_update
I would like you to remember that I like linear algebra.,memory_update
Don't forget that I get confused by history.,memory_update
Make a note that I want help with music.,memory_update
Could you remember that I am interested in writing?,memory_update
Remember that I am learning fantasy stories.,memory_update
Put this in my memory: my favorite food is pizza.,memory_update
"BELT, remember that my current project is about Minecraft.",memory_update
You should remember that I am practicing drawing.,memory_update
Please remember that I prefer examples about puzzles.,memory_update
"BELT, remember that I love websites.",memory_update
Could you remember that my favorite color is lavender?,memory_update
Please remember that I use PyCharm for coding.,memory_update
Don't forget that my favorite color is yellow.,memory_update
Please remember that I usually code in Python.,memory_update
I want you to remember that I prefer examples about math.,memory_update
Please don't forget this about me: I play game design.,memory_update
Add this note about me: I use VSCode for coding.,memory_update
"For next time, remember that I am learning animation.",memory_update
"BELT, note that I like puzzles.",memory_update
Important memory: I get confused by game design.,memory_update
Can you keep track of this: I usually code in Java?,memory_update
Please don't forget this about me: I am practicing music.,memory_update
Keep in mind that I use PyCharm for coding.,memory_update
Store this about me: I am learning robotics.,memory_update
"For next time, remember that I am building something with USACO.",memory_update
Save that my current project is about computer vision.,memory_update
Store this about me: my favorite game is video games.,memory_update
Important memory: I am building something with video games.,memory_update
Please save this detail: I like Brawl Stars.,memory_update
Note that I play Python.,memory_update
Make a note that I play music.,memory_update
Please remember this about me: I am learning neural networks.,memory_update
Please remember this about me: I am interested in data science.,memory_update
