text,intent
okay just what is your favorite color!!,chat
"robot, tell me about yourself for a second",chat
Can you look up information about the difference between chat and knowledge lookup?,knowledge_lookup
"robot, can we chat for a bit thanks",chat
"wait I mean, are you a chatbot thanks",chat
Move one step to the right.,movement
"robot, drive away from me just a tiny bit",movement
What's the difference between obstacle avoidance and something similar?,knowledge_lookup
"robot, I mean, ask me something interesting for a second",chat
can you roll clockwise a bit when you can,movement
Point me toward the main entrance.,navigation
what does memory mean!!,chat
"okay I mean, are you a robot for a second",chat
actually I moved houses last year lol,chat
How does n-grams work?,knowledge_lookup
Can you make this sentence better?,chat
"BELT, are you a robot please",chat
Keep in mind that I am working on a robot project.,memory_update
Help me get to room 101.,navigation
Store this: I like detailed math explanations.,memory_update
can you talk!!,chat
walk left just a tiny bit when you can,movement
Please remember that my favorite animal is a porcupine.,memory_update
What's the difference between a confusion matrix and something similar?,knowledge_lookup
can you scoot counterclockwise just a tiny bit,movement
Tell me the basics of SLAM.,knowledge_lookup
Can you teach me about what brainstorm means?,knowledge_lookup
"okay, drive left carefully please",movement
actually just give me motivation,chat
What does the difference between chat and knowledge lookup mean?,knowledge_lookup
"uh I mean, I moved houses last year rn",chat
How does weather today work?,knowledge_lookup
Why is UCSC useful?,knowledge_lookup
Can you explain an SVM?,knowledge_lookup
just can you give me a quick pep talk?,chat
"By the way, I am building BELT.",memory_update
What's the difference between macro F1 and something similar?,knowledge_lookup
"BELT, just who are you please",chat
hmm just explain that differently for a second,chat
please face toward me three steps,movement
bro can you make this less awkward if you can,chat
What does battery voltage mean?,knowledge_lookup
I need you to shift right one step,movement
Give me a quick definition of the difference between chat and knowledge lookup.,knowledge_lookup
actually what does memory mean for a second,chat
okay tell me about yourself for a second,chat
"BELT, scoot toward me one step",movement
Face me.,movement
yo can you make this less awkward thanks,chat
What is scikit-learn pipelines?,knowledge_lookup
yo I moved houses last year,chat
"actually I mean, explain that differently?",chat
hmm Can we chat for a bit rn,chat
"yo, go left about a foot please",movement
uh what are you for a second,chat
can you roll forward two steps real quick,movement
Can you look up information about a confusion matrix?,knowledge_lookup
Why is the C parameter useful?,knowledge_lookup
I want you to remember that I like robotics.,memory_update
"BELT, what is your robot name rn",chat
"um I mean, save the model file real quick",chat
What is the definition of motivation?,knowledge_lookup
hey What can you do!!,chat
"hey, rotate forward about a foot carefully please",movement
Why is Python joblib useful?,knowledge_lookup
"robot, what are you?",chat
okay I moved houses last year if you can,chat
hmm what are you?,chat
"hmm I mean, can you give me a quick pep talk thanks",chat
actually just rewrite this so it sounds nicer if you can,chat
That movie was good.,chat
"okay I mean, can you make this less awkward!!",chat
Are you having a good day?,chat
Which way should I go to reach the computer science building?,navigation
What is UCSC?,knowledge_lookup
wait just can we chat for a bit real quick,chat
Note that I put my notebook in my backpack.,memory_update
Save this about me: my name is Bella.,memory_update
can you roll to my left two steps real quick,movement
Please remember that I want concise code comments.,memory_update
Can you look up information about the nearest emergency exit?,knowledge_lookup
"okay I mean, can you give me a quick pep talk?",chat
can you move left a couple steps,movement
"um I mean, what is your robot name for a second",chat
Which way should I go to reach the front desk?,navigation
I need you to scoot back three steps,movement
please back up counterclockwise just a tiny bit,movement
"BELT, can you help with coding for a second",chat
Can you remember that I play Brawl Stars?,memory_update
turn forward two steps,movement
"BELT, why is Python joblib useful?",knowledge_lookup
uh can you make this less awkward lol,chat
Can you escort me to the quiet study area?,navigation
"okay, turn farther away about a foot real quick",movement
Do you like coding?,chat
hmm are you a robot please,chat
"BELT, can you help with coding lol",chat
Hello there.,chat
"hey, what is TF-IDF?",knowledge_lookup
"okay, face clockwise two steps for a second",movement
"BELT, the movement was smooth thanks",chat
can you rotate to my left slightly slowly please,movement
uh just what is your robot name rn,chat
Update my memory: I like mint chocolate chip ice cream.,memory_update
"yo, walk backward slowly",movement
yo could you rewrite this so it sounds nicer for a second,chat
hmm what is your favorite color rn,chat
I don't get it yet.,chat
"when it's safe, i need directions to the robotics lab.",navigation
"BELT, just what is your robot name for a second",chat
I need you to walk toward me just a tiny bit,movement
yo just that movie was awesome if you can,chat
yo Make this sentence clearer!!,chat
Did you know I am studying logistic regression? Remember that.,memory_update
"BELT, just can you talk for a second",chat
"buddy, walk to my left two steps",movement
actually just save the model file?,chat
Remember when we talked about models?,chat
actually What does memory mean thanks,chat
um just are you a chatbot if you can,chat
Show me the way to the bus stop.,navigation
please go counterclockwise slowly,movement
I need you to shift clockwise one step,movement
Hey robot friend.,chat
"robot, just help me brainstorm rn",chat
I need facts about campus safety rules.,knowledge_lookup
I want you to remember that I am building BELT.,memory_update
Can you take me back to the next room?,navigation
Note that I am building BELT.,memory_update
"Just so you know, I go by Alex.",memory_update
uh help me brainstorm thanks,chat
I need directions to the next room.,navigation
yo show me the way to the lab room.,navigation
hmm what is your favorite color please,chat
"for my project, why is the nearest emergency exit useful?",knowledge_lookup
Navigate to the previous room.,navigation
I need directions to the bus stop.,navigation
Show me the way to the library.,navigation
can you roll away from me three steps for a second,movement
"buddy, face left a little",movement
"Just so you know, I learn better from step by step explanations.",memory_update
please face back slightly,movement
Go check out the cafeteria.,navigation
Store this: I prefer friendly responses.,memory_update
"BELT, move back a little",movement
"hey BELT, walk me to the office.",navigation
Bring me to the nearest exit.,navigation
"hey, move farther away a little for a second",movement
Go to the lab room and wait there.,navigation
I need you to face to my left one step,movement
"Just so you know, my laptop is on the desk.",memory_update
What is your favorite animal?,chat
"Just so you know, my favorite IDE is VSCode.",memory_update
yo i need directions to the parking lot.,navigation
Shift to the side.,movement
"okay I mean, can you give me a quick pep talk for a second",chat
I need you to drive back a couple steps,movement
Save that I prefer YouTube over TikTok.,memory_update
Why is a confusion matrix useful?,knowledge_lookup
"actually I'm bored, talk to me rn",chat
"bro I mean, how are you?",chat
yo the movement was smooth,chat
uh Can you give me a quick pep talk lol,chat
I need you to drive away from me slowly,movement
what can you do!!,chat
"hey, store this: I like detailed math explanations.",memory_update
"hey, save that I put my notebook in my backpack.",memory_update
"for my project, tell me the basics of scikit-learn pipelines.",knowledge_lookup
I need you to move closer slightly,movement
okay can you make this less awkward?,chat
"robot, I mean, are you a chatbot thanks",chat
How do I install scikit-learn?,knowledge_lookup
Can you guide me to the nearest exit?,navigation
bro that movie was awesome!!,chat
Did you know I enjoy USACO? Remember that.,memory_update
What does the C parameter mean?,knowledge_lookup
"From now on, know that I use Python.",memory_update
"BELT, rotate clockwise a little",movement
"hey, shift clockwise just a tiny bit when you can",movement
I need you to rotate clockwise carefully,movement
Where is the nearest emergency exit?,knowledge_lookup
That makes sense.,chat
quick memory update: add this to my memory: I am studying logistic regression.,memory_update
can you roll backward three steps if it's safe,movement
Why is regularization useful?,knowledge_lookup
"hey, what does precision and recall mean?",knowledge_lookup
shift right three steps slowly please,movement
"BELT, just that movie was awesome?",chat
"robot, that movie was awesome",chat
actually Make this sound less awkward thanks,chat
wait move on to the next idea lol,chat
What are you?,chat
hey I moved houses last year rn,chat
please walk clockwise slightly,movement
"for my project, can you look up information about SLAM?",knowledge_lookup
What's the difference between today's date and something similar?,knowledge_lookup
"BELT, I moved houses last year lol",chat
actually what is your favorite color!!,chat
Update my memory: I want you to use fewer emojis.,memory_update
Point me toward the stairs.,navigation
Can you escort me to the maker space?,navigation
can you walk closer slightly when you can,movement
yo how do I get to the previous room?,navigation
bro just tell me about yourself thanks,chat
Can you explain obstacle avoidance?,knowledge_lookup
Can you teach me about TF-IDF?,knowledge_lookup
"when it's safe, can you find a route to the quiet study area?",navigation
Why is a vectorizer useful?,knowledge_lookup
"when it's safe, go check out the robotics lab.",navigation
"actually I mean, who are you?",chat
Navigate to the office.,navigation
Tell me the basics of Python joblib.,knowledge_lookup
hmm what is your purpose thanks,chat
Can you explain pandas read_csv?,knowledge_lookup
What does weather today mean?,knowledge_lookup
um just move on to the next idea for a second,chat
can you go forward about a foot for a second,movement
Move forward two steps.,movement
hey Ask me something interesting lol,chat
hmm just can you introduce yourself if you can,chat
That answer was helpful.,chat
hmm that movie was awesome,chat
Scoot right a bit.,movement
What is a lidar sensor?,knowledge_lookup
I need facts about the definition of motivation.,knowledge_lookup
"robot, could you ask me something interesting thanks",chat
please roll clockwise carefully,movement
What is the formula for logistic regression?,knowledge_lookup
yo Who are you for a second,chat
I need facts about micro F1.,knowledge_lookup
please face back a little,movement
uh can we chat for a bit rn,chat
"BELT, i want you to remember that I want you to call me chief.",memory_update
okay can you give me a quick pep talk thanks,chat
"buddy, walk closer slightly",movement
"robot, could you make this sentence clearer!!",chat
hey Rewrite this so it sounds nicer real quick,chat
bro just can you help with coding,chat
"hmm I mean, what can you do for a second",chat
Can you find a route to the lab room?,navigation
Note that my favorite IDE is VSCode.,memory_update
I need you to roll back a bit,movement
Update my memory: I prefer friendly responses.,memory_update
hmm just tell me a joke?,chat
um can you escort me to the library?,navigation
Can you escort me to the library?,navigation
What should I know about macro F1?,knowledge_lookup
just can you give me a quick pep talk for a second,chat
I need you to scoot toward me slightly,movement
Please remember that I am building BELT.,memory_update
"hey, give me a quick definition of Python joblib.",knowledge_lookup
hmm what can you do for a second,chat
"BELT, for future chats, remember that I enjoy USACO.",memory_update
Tell me the basics of weather today.,knowledge_lookup
Can you lead me down the hallway?,navigation
"BELT, what is your favorite animal lol",chat
Bring me to the quiet study area.,navigation
um take me to the nearest exit.,navigation
uh just what does memory mean please,chat
um can we chat for a bit!!,chat
Please remember that my favorite color is blue.,memory_update
Can you remember that my favorite IDE is VSCode?,memory_update
Can you remember that I am your creator?,memory_update
I need you to rotate counterclockwise two steps,movement
Tell me the basics of the C parameter.,knowledge_lookup
can you back up to my left one step when you can,movement
"yo I mean, what are you!!",chat
I need you to go counterclockwise about a foot,movement
"robot, I mean, that movie was awesome real quick",chat
Give me a quick definition of class weights.,knowledge_lookup
can you turn counterclockwise slightly please,movement
um rewrite this so it sounds nicer please,chat
What's the difference between robot navigation and something similar?,knowledge_lookup
Lead me to room 101.,navigation
What is the meaning of this error?,chat
Go to the front desk and wait there.,navigation
Bring me to the previous room.,navigation
drive to my right a bit carefully please,movement
um can you escort me to the emergency exit?,navigation
Help me get to the gym.,navigation
yo could you rewrite this so it sounds nicer?,chat
okay just what are you!!,chat
um can you talk real quick,chat
Turn right or something.,movement
"BELT, i want you to remember that I prefer simple explanations.",memory_update
Bring me to the next room.,navigation
Tell me the basics of a decision boundary.,knowledge_lookup
wait just ask me something interesting rn,chat
"BELT, i want you to remember that my favorite platform is Instagram.",memory_update
What's the difference between TF-IDF and something similar?,knowledge_lookup
bro could you ask me something interesting if you can,chat
uh could you tell me about yourself if you can,chat
What's the difference between what brainstorm means and something similar?,knowledge_lookup
I need you to drive closer one step,movement
"robot, just who are you real quick",chat
Can you do a small movement?,movement
Do a small movement.,movement
Go to the office and wait there.,navigation
actually can you introduce yourself,chat
"okay, rotate closer three steps real quick",movement
Tell me the basics of obstacle avoidance.,knowledge_lookup
I need you to face to my left carefully,movement
wait could you explain that differently thanks,chat
Move just a little.,movement
I need you to roll clockwise slowly,movement
Do you prefer Instagram or TikTok?,chat
uh can you help me plan my project lol,chat
Can you guide me to the maker space?,navigation
"also, save this about me: I like mint chocolate chip ice cream.",memory_update
Can you explain TF-IDF?,knowledge_lookup
um can you take me back to the robotics lab?,navigation
bro just make this sound less awkward if you can,chat
Make one tiny movement.,movement
quick question: tell me the basics of a confusion matrix.,knowledge_lookup
turn to my right one step for a second,movement
Bring me to the stairs.,navigation
hey just I moved houses last year for a second,chat
How do I get to the office?,navigation
Can you find a route to the office?,navigation
"BELT, save that I go by Alex.",memory_update
Can you help me study?,chat
Can you walk with me to the door?,navigation
Tell me the basics of campus safety rules.,knowledge_lookup
yo How are you!!,chat
quick memory update: update my memory: I use Python.,memory_update
Note that I like mint chocolate chip ice cream.,memory_update
"Go check out the previous room, then come back.",navigation
Add this to my memory: I prefer friendly responses.,memory_update
um what is your favorite animal please,chat
What does a decision boundary mean?,knowledge_lookup
"From now on, know that my favorite platform is Instagram.",memory_update
just what is your favorite color,chat
yo just who are you!!,chat
Can you take me back to the main entrance?,navigation
uh can you talk if you can,chat
um what does memory mean please,chat
I need facts about KNN.,knowledge_lookup
actually could you tell me a joke!!,chat
I need you to move farther away carefully,movement
"robot, the movement was smooth thanks",chat
Navigate to the bathroom.,navigation
"for my project, can you look up information about n-grams?",knowledge_lookup
can you shift toward me a bit,movement
rotate back a little when you can,movement
What should I know about today's date?,knowledge_lookup
Lead me to the stairs.,navigation
hey can you introduce yourself rn,chat
hmm I moved houses last year real quick,chat
"hey, what should I know about class weights?",knowledge_lookup
"BELT, turn forward carefully",movement
"yo I mean, that makes sense for a second",chat
"okay I mean, that was funny rn",chat
Give me a quick definition of scikit-learn pipelines.,knowledge_lookup
"Okay, that makes sense now.",chat
What does an SVM mean?,knowledge_lookup
Go check out the office.,navigation
I need directions to the previous room.,navigation
Navigate to the computer science building.,navigation
What's the difference between scikit-learn pipelines and something similar?,knowledge_lookup
yo show me the way to the cafeteria.,navigation
"wait I mean, what can you do if you can",chat
"robot, can you help with coding lol",chat
What is precision and recall?,knowledge_lookup
okay could you make this sentence clearer rn,chat
"buddy, rotate closer a little",movement
Can you explain a lidar sensor?,knowledge_lookup
please back up forward slightly,movement
"hey I mean, save the model file thanks",chat
I need directions to the cafeteria.,navigation
um just what is your favorite color real quick,chat
"From now on, know that I want concise code comments.",memory_update
um which way should I go to reach the classroom?,navigation
yo can we chat for a bit!!,chat
"BELT, I mean, can we chat for a bit please",chat
"okay, drive counterclockwise two steps when you can",movement
Can you guide me to the previous room?,navigation
"yo, go clockwise just a tiny bit if it's safe",movement
"Good evening, how are you?",chat
"Bro, move like a couple steps back.",movement
hey That movie was awesome real quick,chat
just can you help me plan my project!!,chat
What does navigation mean for a robot?,knowledge_lookup
quick question: what is a confusion matrix?,knowledge_lookup
Give me a quick definition of today's date.,knowledge_lookup
"BELT, go to my right just a tiny bit",movement
okay can you introduce yourself if you can,chat
Can you escort me to the bus stop?,navigation
"BELT, note that I like soccer.",memory_update
"BELT, why is campus safety rules useful?",knowledge_lookup
yo which way should I go to reach the nearest exit?,navigation
"robot, I mean, help me brainstorm please",chat
"hey BELT, show me the way to the computer science building.",navigation
"hmm I mean, what are you for a second",chat
Do you know my favorite puzzles?,chat
That makes sense.,chat
Why is Minecraft so goofy?,chat
How are you doing?,chat
What is your robot name?,chat
What do you remember about me?,chat
Do robots like mint chocolate chip ice cream?,chat
What is my name?,chat
Can you tell me a joke?,chat
woah who are you,chat
What is something fun about science?,chat
Yo BELT.,chat
What is your favorite color?,chat
Good evening BELT.,chat
Can you give me motivation?,chat
Do you know who I am?,chat
Can you talk?,chat
Why is game design so super helpful?,chat
Do robots like noodles?,chat
Can you help me think through an idea?,chat
Can you make this sound less awkward?,chat
Do robots like blueberries?,chat
What do you think about soccer?,chat
Is linear algebra goofy?,chat
What is something fun about Java?,chat
Why is coding so easy?,chat
What can you do?,chat
Can you help me brainstorm?,chat
Do you know my favorite drawing?,chat
Can you remember things?,chat
How has your day been?,chat
Good afternoon BELT.,chat
"I'm bored, talk to me.",chat
Can you compare USACO and writing?,chat
That was funny.,chat
Tell me something boring.,chat
What are you doing right now?,chat
"Hey, what's up?",chat
Do you like talking to people?,chat
Are you a campus robot?,chat
What is your favorite animal?,chat
I think campus robots is underrated.,chat
Can you help with coding?,chat
Do you like linear algebra?,chat
Can you give me a short answer about YouTube?,chat
Why is websites so hard?,chat
Can you quiz me on Minecraft?,chat
What is a simple way to understand YouTube?,chat
Can you compare campus robots and math?,chat
Can you say that simpler?,chat
Is puzzles chaotic?,chat
Can you compare drawing and science?,chat
What is something fun about Python?,chat
I think soccer is super helpful.,chat
Do robots like tacos?,chat
Can we chat for a bit?,chat
Good morning BELT.,chat
Can you compare fantasy stories and history?,chat
Why is PCA so easy?,chat
What should I do today?,chat
Why is science so simple?,chat
Can you explain what you are?,chat
Can you quiz me on campus robots?,chat
I think USACO is underrated.,chat
Hello there.,chat
I think AI is chaotic.,chat
What do you think about fantasy stories?,chat
Is USAAIO overrated?,chat
I think computer vision is goofy.,chat
Can you help me study?,chat
Tell me something interesting.,chat
Can you give me a short answer about coding?,chat
What is a simple way to understand puzzles?,chat
Do you know my favorite hackathons?,chat
Can you compare websites and Minecraft?,chat
Tell me something overrated.,chat
Hi BELT!,chat
Can you compare science and Brawl Stars?,chat
Can you compare music and fantasy stories?,chat
Tell me something easy.,chat
Can you quiz me on math?,chat
Do you know my favorite neural networks?,chat
Do robots like ramen?,chat
Is AI chaotic?,chat
Can you be more specific?,chat
Do you have a personality?,chat
"BELT, are you awake?",chat
Can you compare history and hackathons?,chat
Can you quiz me on game design?,chat
Can you compare fantasy stories and writing?,chat
Do you know my favorite video games?,chat
Tell me something complicated.,chat
Can you compare USAAIO and campus robots?,chat
Can you help me plan my day?,chat
Can you give me a short answer about soccer?,chat
Can you compare coding and animation?,chat
Do you like robots?,chat
I think math is weird.,chat
I think websites is kinda sus.,chat
Do you know my favorite history?,chat
Can you compare hackathons and AI?,chat
Do you remember what I like?,chat
"Wait, explain that again.",chat
Can you give me a short answer about robotics?,chat
Can you quiz me on USAAIO?,chat
Why is math so surprising?,chat
What is a simple way to understand PCA?,chat
I think websites is weird.,chat
Is animation easy?,chat
What is something fun about linear algebra?,chat
Why is YouTube so surprising?,chat
Can you give me a short answer about PCA?,chat
Do robots like waffles?,chat
Can you give me a short answer about neural networks?,chat
Do you like history?,chat
What is something fun about music?,chat
Do you like campus robots?,chat
Tell me something weird.,chat
Is writing surprising?,chat
Do robots like curry?,chat
Can you give me a short answer about USAAIO?,chat
Do robots like pasta?,chat
Is AI useful?,chat
Can you give me a short answer about Minecraft?,chat
Do you know my favorite soccer?,chat
Do robots like chocolate?,chat
Is game design interesting?,chat
I think soccer is easy.,chat
Can you give me a short answer about Brawl Stars?,chat
I think AI is weird.,chat
Can you compare Brawl Stars and linear algebra?,chat
Do you know my favorite YouTube?,chat
Why is Brawl Stars so surprising?,chat
Tell me something pretty neat.,chat
Can you compare linear algebra and animation?,chat
Do you like music?,chat
Do you like YouTube?,chat
What is something fun about math?,chat
Do robots like strawberries?,chat
Tell me something hard.,chat
Do you know my favorite Java?,chat
Can you give me a short answer about writing?,chat
Do you know my favorite math?,chat
Do you like data science?,chat
Do you like machine learning?,chat
What is something fun about game design?,chat
Do robots like sushi?,chat
What do you think about animation?,chat
Tell me something funny.,chat
Can you quiz me on history?,chat
Can you give me a short answer about machine learning?,chat
What is something fun about puzzles?,chat
Can you compare video games and machine learning?,chat
Is puzzles easy?,chat
What do you think about linear algebra?,chat
Tell me something exciting.,chat
What is a simple way to understand machine learning?,chat
Do you like science?,chat
What is a simple way to understand USACO?,chat
Can you compare robots and soccer?,chat
Can you compare game design and hackathons?,chat
I think campus robots is boring.,chat
Do you know my favorite Brawl Stars?,chat
Do you like PCA?,chat
Can you compare Java and data science?,chat
I think writing is awesome.,chat
Tell me something surprising.,chat
Do robots like bagels?,chat
Do you like drawing?,chat
I think PCA is cool.,chat
Is PCA weird?,chat
Tell me something useful.,chat
Is computer vision underrated?,chat
Can you quiz me on data science?,chat
I think drawing is wholesome.,chat
Is drawing wholesome?,chat
Tell me something simple.,chat
Can you compare Brawl Stars and USAAIO?,chat
Is soccer exciting?,chat
Can you quiz me on linear algebra?,chat
Do you like AI?,chat
Why is USAAIO so pretty neat?,chat
Do you like USACO?,chat
Do you like hackathons?,chat
Why is AI so underrated?,chat
Tell me something awesome.,chat
What is something fun about Minecraft?,chat
What is a simple way to understand websites?,chat
Do you like Minecraft?,chat
Do you like puzzles?,chat
I think YouTube is awesome.,chat
Can you quiz me on soccer?,chat
